review_date,review_title,review_body_text,overall_review_rating,job_title,location,employee_flag,rating_work_life_balance,rating_compensation_benefits,rating_job_security_advancement,rating_management,rating_culture_values,pros_text,cons_text,page_number,start_offset,source_url
18 January 2019,Sport Activities,"Organise a healthy sport activities to employees, such as dodgeball, badminton, ping pong, hiking, swimming and etc. Also, improve the relationship between employees with the help of sport",5,Senior Executive,George Town,current,0,0,0,0,0,,,10,180,https://malaysia.indeed.com/cmp/Public-Bank-Berhad/reviews?start=180
16 November 2018,Good company,"It is great to work with Public Bank if you have a good Branch Manager. Staff benefits are excellent. Contractual bonus, sufficient annual leave, good working environment.",4,Teller,Kl Sentral,former,3,5,4,2,2,Year end bonus,Stingy branch manager,10,180,https://malaysia.indeed.com/cmp/Public-Bank-Berhad/reviews?start=180
28 October 2018,Good benefits & friendly colleagues,Remuneration package among the best in the industry. Average 5 months bonus. Annual increment is very decent. Attractive staff rates for housing and car loan.,4,Senior Financial Executive,Kuala Lumpur,former,2,5,4,4,4,Good bonus each year,Long working hours,10,180,https://malaysia.indeed.com/cmp/Public-Bank-Berhad/reviews?start=180
27 October 2018,Stressful work environment but the reward/benefits given are great,"During my tenure at Public Bank, I am part of Hire Purchase Credit Processing HP Centre. With team of 10 Officers, each of us need to process an average of 10 cases per day and was given 3 days to submit a decision whether the customer submission approved or rejected. It's very stressful as the pace of new case submission was very fast and It need me to go back home late everyday. Different department has different challenges. Like Housing Loan Department are less stressful as officer part only on customer credit evaluation. The rest will be done by panel lawyer as it involves government agencies. For Frontline Counter they are facing Queue Management System (QMS) which HQ will track how many customers are waiting for their number to be call in more than 2 minutes. But the best part in Public Bank, of course the bonus and ex-gratia. The management are good in taking care staff welfare. Medical benefit are given to staff and their families, 2 months bonus are given to all staff every year and in addition special ex-gratia based on staff performance up to 5 months and low interest rate 0% - 2% for staff housing loan. Overall, although work environment are stressful but working in Public Bank build my personality in terms of work wise fast and accurate, customer handling and evaluation, useful experience, etc",5,Senior Executive,Public Bank Taman Molek HP Centre JB,former,3,5,4,4,3,"Medical Benefits, Staff Housing Loan, Bonus/Ex-gratia",Work Loading,10,180,https://malaysia.indeed.com/cmp/Public-Bank-Berhad/reviews?start=180
16 October 2018,Largest Local Bank,"Totalyy a different way of working, as this follow the Local way on culture and mix only local people and working across with State in Malaysia and understanding their Culture",5,Operations Control & Inspection Audit Clerk,Kuala Lumpur,former,5,5,5,5,5,,,10,180,https://malaysia.indeed.com/cmp/Public-Bank-Berhad/reviews?start=180
14 October 2018,hassle workplace,"I enjoy working here because i get many benefits such as spectacles allowance that can be claimed annually, year end bonuses and full medical claim. But, working as bank teller is quite challenging because you need to fulfill customer needs but at the same time you need follow guidelines. Nevertheless, a lot of things we can learn about finance.",2,Bank Teller,"Raub, Pahang, MALAYSIA",current,3,4,4,3,4,"Cost of Living Allowance, spectacles allowance, bonuses, full medical benefit",management,10,180,https://malaysia.indeed.com/cmp/Public-Bank-Berhad/reviews?start=180
13 October 2018,a good place to work,"a very good place, environment of work. learning how to do sales with a proper guide from senior. the top management also plays their roles in helping new employee to adapt with the work situation",5,Marketing Executive,kedah,former,4,5,5,3,5,,hard to achieve target,10,180,https://malaysia.indeed.com/cmp/Public-Bank-Berhad/reviews?start=180
11 October 2018,place where you can learn a lot of things,"Good exposure especially for fresh grad to start their career life. For the younger generation, they need to adapt to baby boomers culture. All its senior management are baby boomers. If they are humble to learn , they will learn a lot. How ever , if they are impatient , they will find big gap to communicate and implement the task.",2,management trainee,Kuala Lumpur,current,2,4,2,2,2,compensation,"long working hours, full load of works",10,180,https://malaysia.indeed.com/cmp/Public-Bank-Berhad/reviews?start=180
6 September 2018,Presentation Skills,This is the first job after I graduated. I can learn the presentation skills and communication skills. Besides I can be more confident to speak with customers.,3,Banc assurance Sales Executive,Perak,former,3,3,3,3,3,Presentation Skills,Long Hours,10,180,https://malaysia.indeed.com/cmp/Public-Bank-Berhad/reviews?start=180
3 September 2018,Busy working environment.,"Public bank is a good company providing lots of benefits to the staffs. However, the working environment is bad as the working culture is terrible all the times. Top management and branch management unable to work as a team as the direction always different.",3,Senior Executive,Johor Bahru,current,3,5,4,3,2,Good staff benefits low rate housing loan and family medical benefits,Bad management team with bad working culture,10,180,https://malaysia.indeed.com/cmp/Public-Bank-Berhad/reviews?start=180
8 July 2018,Good working environment,"Remuneration package among the best in the industry. Average 5 months bonus. Annual increment is very decent. Attractive staff rates for housing and car loan. Work life balance is acceptable depending on which department you work at and the boss you work for. Staff dismissal is rare and unheard of except in extreme cases. Great place to work to raise a family and retire. Company prefers to hire fresh graduates than outsiders. Career progression is steady, even predictable up to a certain level.",5,Senior Sales & Marketing Executive,malaysia,current,1,4,5,5,5,,no work life balance,10,180,https://malaysia.indeed.com/cmp/Public-Bank-Berhad/reviews?start=180
2 July 2018,Productive and fun working environment,Working in Public bank was really bring me a lot of experience. The way of communicate with problem customer and how to work in a big team. The fun of the work place is we can meet many different type of customer and colleagues.,4,Clerk,Shah Alam Selanor,former,5,4,5,5,5,,,10,180,https://malaysia.indeed.com/cmp/Public-Bank-Berhad/reviews?start=180
25 June 2018,Long working hours but love the colleagues,"A typical day at work would be processing ad hoc appraisal reports for new recruits / internal promotions. Also includes handling annual increment, performance bonus and year-end bonus. I learned a lot about handling problematic staff and dealing with higher management people. The workplace culture is pretty traditional - your boss is always right! Hardest part of the job would have to be juggling ~10 tasks (all with the same deadlines!) At the same time, it's also the most enjoyable part of the job - the sense of satisfaction you get when you manage to complete everything on your to-do list.",3,Senior Executive,Kuala Lumpur,current,2,4,3,3,4,"Great staff benefits, bonuses, no office politics",Boss can be crazy during peak period,10,180,https://malaysia.indeed.com/cmp/Public-Bank-Berhad/reviews?start=180
25 June 2018,Productive and Having Fun with the colleagues,"Try to communicate with each other from another department, they can assists us to archiving target or sales. They are more experience and has work at the banking industries for many years.",5,Financial Executive,Kerian,former,4,5,4,5,5,,"Courses required and license exam foc, phone bill claimed max rm120",10,180,https://malaysia.indeed.com/cmp/Public-Bank-Berhad/reviews?start=180
24 June 2018,Average working environment,A good place for fresh graduates Learning of market is competitive Learning of the real working society Learning of need self discipline Learning of time management,3,Hire Purchase Sales and Marketing,Petaling Jaya,former,3,3,3,3,3,,,10,180,https://malaysia.indeed.com/cmp/Public-Bank-Berhad/reviews?start=180
12 June 2018,Extra long working hours even on weekends,PBB is a very systematic and established company but the working hour is too long and it is compulsory to stay late everyday even you had finish your job. It is very often that you will be called in to work overtime on weekend but only able to claim half of the full overtime amount.,3,Senior Executive,Malaysia,former,1,3,4,3,3,,"very long hours, compulsory to stay late at work everyday.",10,180,https://malaysia.indeed.com/cmp/Public-Bank-Berhad/reviews?start=180
11 June 2018,Productive,Good place to learn new things. Programming is the essential for my position. Management very strict in term of task completion and concern what staff need. Hardest part will be to accomplish project and task given before the dateline. Friends and team will be the best thing.,3,Analyst Programmer,Malaysia,current,4,3,4,5,4,Medical benefit,Extended working hours,10,180,https://malaysia.indeed.com/cmp/Public-Bank-Berhad/reviews?start=180
5 June 2018,Working together as a team work .,To provide curteous and efficiency in customer services. Done all the work assign by senior office on the same day. Be a punctual staff on working time.,4,Clerk/Typist/Cashier,Malaysia,former,4,4,4,4,4,Ot,office hour,10,180,https://malaysia.indeed.com/cmp/Public-Bank-Berhad/reviews?start=180
19 May 2018,Enjoy the workplace,Good workplace for develop skill and knowledge. Good management. Very condusive and clean place. You can discover new things here. Suitable for person eho love kids very much. Can handle stress very well.,5,Senior Financial Executive,Kuala Terengganu,former,5,5,5,5,5,"Free lunch, all the staff women",Must be multitasking person,10,180,https://malaysia.indeed.com/cmp/Public-Bank-Berhad/reviews?start=180
16 May 2018,Productive and Efficient Company,"Great Company and provide good benefits for staff, but didnt plan well on staff career enhancement for certain department. Able to learn a lot knowledge and provide continue training to staff",4,Senior Finance Executive,Malaysia,former,1,5,3,3,5,Salary and bonus,Long hours and have to work on weekend,11,200,https://malaysia.indeed.com/cmp/Public-Bank-Berhad/reviews?start=200
7 May 2018,Depends on your working mates.,the management are so good. but the environment depends on how good your workmates. they could influence your working surroundings. try your best to mingle with the correct person so that you will have a good motivation to go to work everyday.,4,Senior Executive,Kuala Lumpur,former,3,5,4,3,3,,,11,200,https://malaysia.indeed.com/cmp/Public-Bank-Berhad/reviews?start=200
28 March 2018,Provides a stable income,"I was in charge of the Bank's operational aspect. Daily movement of physical cash, accounts, staff training & annual leaves, compliances & reporting.",4,Assistant Branch Manager,Ipoh,former,3,3,3,3,3,Generous staff loans for housing & vehicles,Too tied up with paper work,11,200,https://malaysia.indeed.com/cmp/Public-Bank-Berhad/reviews?start=200
16 March 2018,Productive and good benefits,"This company is very good on their benefits Medical, they have cola allowance, and also bonus every years. Daily working quite busy due to the have to achieve time for attending customer.Workplace culture was very good. The hardest part on this job is only when the bank is full waiting about 300 person before and after holiday( in seri petaling branch).Enjoyable part is when they have trip under company.",5,FRONTLINE TELLER,SERI PETALING,former,4,5,5,5,5,Increament,Healthcare,11,200,https://malaysia.indeed.com/cmp/Public-Bank-Berhad/reviews?start=200
8 March 2018,Good company in terms of remuneration but not much opportunity for career advancement,"Run! if you are looking for career advancement place. Work environment highly dependent on which branch you are placed in. Be prepared to work hard, work late and ability to multitask is a plus point!",4,SENIOR EXECUTIVE,kota kinabalu,current,3,4,2,3,3,Low housing loan rates; good bonus,"long working hours, career advancement almost non existent",11,200,https://malaysia.indeed.com/cmp/Public-Bank-Berhad/reviews?start=200
7 March 2018,Productive and best working place ever,5 Working days. My 1st and best working experience ever for 7 years. Learned to attend and face customers directly. And to solve many management issues. Fun and productive collegues. So far I didn't find any hardest or easiest job in my experiences. Tq,4,CLERK/TELLER/CASHIER,MALAYSIA,former,4,4,4,4,4,,,11,200,https://malaysia.indeed.com/cmp/Public-Bank-Berhad/reviews?start=200
13 February 2018,"productive,enjoyable",i not enjoy the inviroment at my office now.the work culture is not okay today.so tired every day to travelling from my home to workplace.benefit also no satisfied to me.,2,Clerk - Public Bank Team,Kuala Lumpur,former,2,2,2,2,2,,,11,200,https://malaysia.indeed.com/cmp/Public-Bank-Berhad/reviews?start=200
5 February 2018,Fun to work with Public Bank,"Happy to work almost 10 years in banking line, What i learn is operation and loan department. Management is messy woth workloads. Hardest part of the job is team is not helping each other with workloads. The most enjoy thing is five working days in bank.",4,Officer / Executive,Malacca City,former,3,4,4,2,3,Bonus,Loaded with works,11,200,https://malaysia.indeed.com/cmp/Public-Bank-Berhad/reviews?start=200
24 January 2018,typical day at work,"I like to help people. Position of a teller offers a unique chance to combine the two things in one job. I really like the customer service. It’s a good idea to pay attention to what the managers are doing and learn about things like mortgages and other loans, reading credit reports, etc. You may need a loan in the future or decide to become a homeowner someday and it’s a good idea to know what options you have and to understand the importance of good credit.",3,Teller,Johor,former,4,3,5,4,4,,,11,200,https://malaysia.indeed.com/cmp/Public-Bank-Berhad/reviews?start=200
12 January 2018,Best Training Ground,It is a best training ground for fresh graduate to develop and growth ourself with the work culture and environment. The high demand from management and high volume of job allow us to learn to manage our time well and be multitask to meet the assigned job duties dateline. The most enjoyable part of the job is having a gang of good colleagues who willing to work together and resolve problem together.,4,Senior Operations Executive,Melaka,former,0,0,0,0,0,Good Benefits e.g Housing Loan,Long Hours,11,200,https://malaysia.indeed.com/cmp/Public-Bank-Berhad/reviews?start=200
8 January 2018,Competitive but rewarding,"Competition among colleague is high as branch manager have total authority influencing an individual career progress. Being an credit officer, I am under pressure to balance between productivity and quality work as this would directly affect the bank's books. Nonetheless, the bank provide attractive career pathway where every employees are given opportunity to climb up the corporate ladder.",5,Management Trainee (Credit Analyst),MY,former,2,4,4,4,4,,,11,200,https://malaysia.indeed.com/cmp/Public-Bank-Berhad/reviews?start=200
26 December 2017,Good for fresh graduate.,The top management is consecutive and they are not willing to expose to risk. The workplace culture is horrible which the senior will greatly utilize the young staff. The hardest part is to deal with horrible work culture which emphasize on long working hours. Nothing is enjoyable here.,2,Senior Credit Analyst,Johor,former,2,2,2,2,1,Stable,"Boring, Very Slow Career Advancement.",11,200,https://malaysia.indeed.com/cmp/Public-Bank-Berhad/reviews?start=200
28 November 2017,Challenging,Busy and hectic working place everyday but yet interesting and challenging. A good place to learn with good career advancement. High management expectations with good reward offered.,4,Senior Executive,Melaka City,former,3,4,4,4,4,Good reward and benefit,No,11,200,https://malaysia.indeed.com/cmp/Public-Bank-Berhad/reviews?start=200
31 October 2017,It's a good place to work,"Culture is old school but they take care of their staff. Sometimes promotion is not easy, comes very late. It's usually a busy day at work. Bonus is good. The People are friendly",4,Senior Credit Analyst,Petaling Jaya,former,4,4,4,4,4,Bonus twice a year,Limited technology used,11,200,https://malaysia.indeed.com/cmp/Public-Bank-Berhad/reviews?start=200
26 October 2017,Very productive and fun,"8 years in public bank has been quite overwhelming for me as a bank executive. I work in the operation department. Specifically in the cheque clearing department. I'm a verifier. I verify all the cheques we received from the branches via data everyday. We start 5 am in the morning and we finish at 2 pm in the evening which I would say the most enjoyable part of the job. This job teaches me to be very skillful in observation, decision making and working as a team.",5,Executive,Kuala Lumpur,current,5,5,5,5,5,,,11,200,https://malaysia.indeed.com/cmp/Public-Bank-Berhad/reviews?start=200
18 October 2017,fun,"strict and serious environment , customer service oriented , front line services , professional management , good benefits for employees , fun workplace",3,SPECIAL GRADE CLERK,Johor Bahru,former,3,5,3,3,3,weekend dinner,no overtime,11,200,https://malaysia.indeed.com/cmp/Public-Bank-Berhad/reviews?start=200
5 October 2017,This co is,I working for more with the top 10 banker in Malaysia. I started from clerk until promoted to senior executive. I learn many thing from the co as I started from the bottom. I would like to change my carrier as I see I can't go better future with this co anymore.,4,Asisstan manager,Kuala Lumpur,former,3,4,4,3,3,Time frame,Work flow,11,200,https://malaysia.indeed.com/cmp/Public-Bank-Berhad/reviews?start=200
3 October 2017,Happy to Work,"Overall working in the bank very interesting & Challenging. Learned more banking knowledge and improved myself in planning, multiply savings & saving money",5,RELIEF CASHIER/OFFICE,KUALA LUMPUR MALAYSIA,former,5,5,5,5,5,Fun work with customers,Long working hours,11,200,https://malaysia.indeed.com/cmp/Public-Bank-Berhad/reviews?start=200
2 October 2017,Productive & Challenged Working Enviroment,"Interviewing & processing multiples loan such as housing loan, personal loan & business loan. To perform a Trade Finance Transaction such as Letter of Credit, Trust Receipt, Bankers Acceptance & Bank Guarantee. To perform frontline transaction such as deposit/withdrawal/telegraphic transfer & customer service.",3,Credit Analyst,Johor Bahru,former,2,4,3,3,4,,,11,200,https://malaysia.indeed.com/cmp/Public-Bank-Berhad/reviews?start=200
21 September 2017,Provide good benefit but a tough position for the beginner,Good opportunity for fresh graduate to tried but need to struggle because sales position need you to more active mostly when related in insurance product.,3,Insurance Specialist,Taiping,current,2,4,4,4,3,,,11,200,https://malaysia.indeed.com/cmp/Public-Bank-Berhad/reviews?start=200
12 September 2017,Good place to earn experience,Public Bank is a really good company for anyone to start a career in banking with. It is a well managed company that continue to strive and excel in this ever challenging world and a company that values hard work and dedication in performing everyday task.,4,"Management Trainee, Sales Quality Assurance",Kuala Lumpur,current,0,0,0,0,0,,,12,220,https://malaysia.indeed.com/cmp/Public-Bank-Berhad/reviews?start=220
20 May 2017,Productive and Future driven company,'-very busy working life every day - I learned almost everything from public bank especially management skills and customer service and also multi-tasking. - well organised management - Asian working culture - the hardest part is too much of work and less increment. - United and teamwork,5,Admin Executive,Johor Bahru,former,3,5,5,4,3,Monthly Birthday celebration,lots of works,12,220,https://malaysia.indeed.com/cmp/Public-Bank-Berhad/reviews?start=220
2 May 2017,work hard to get more,'- basic daily jobs are including processing of housing loan applications & customer service - it is important to have well time management and teamwork in order to get the job done - the most enjoyable time will be the time you received your bonuses every year,3,Senior Executive,Johor Bahru,former,2,5,4,3,2,Attractive remuneration package,Long hours,12,220,https://malaysia.indeed.com/cmp/Public-Bank-Berhad/reviews?start=220
16 April 2017,appreciate for everything that i have learn,"it is my first time to work as insurance specialist , it full of challenging and require a lot of skills. i so glad to work in bank as i learnt many banking operation and sales knowledge .",5,Senior Insurance Specialist,Sitiawan,former,5,5,5,5,5,learning banking operation,,12,220,https://malaysia.indeed.com/cmp/Public-Bank-Berhad/reviews?start=220
14 April 2017,Benefits,Public bank is 3rd larges bank in malaysia. Stable companies for more than 50yrs. Goods in staff benefits. Training will be provided for candidates. High paid salary.,3,Executive,Bukit Beruntung,current,5,3,3,4,4,Staff housing loan,Healthcare,12,220,https://malaysia.indeed.com/cmp/Public-Bank-Berhad/reviews?start=220
1 April 2017,"Have some gymnasium ,and always do fizikal training","Good team work in team,always alert in all situation,keep eye on stranger people who make a deal with public bank,always be focus on duty ,and make sure all custumer always in safe situation in good.",5,AUXILIARY POLICE,JOHOR BAHRU,former,3,5,5,5,5,always gathering event.,benefits always protect staff,12,220,https://malaysia.indeed.com/cmp/Public-Bank-Berhad/reviews?start=220
31 March 2017,Effective and conducive learning environment,It was an overall positive experience with Public Bank Berhad in terms of my job scope whereby I get to learn the essential selling skills required to perform in a sales driven position,5,Senior Financial Executive,Kuching,former,5,5,5,5,3,,,12,220,https://malaysia.indeed.com/cmp/Public-Bank-Berhad/reviews?start=220
7 March 2017,Typical 'Chinaman' company,"Public bank is a typical 'chinaman' company. Employees are expected to work hard for company but not being appreciated accordingly. Labor turnover rate is high especially among 80's & 90's youth. Most of them can't accept the seniority culture applicable in the bank. Last but not least, it's still a good starting point for those fresh graduates to learn, a good place to learn the multitasking and stress handling skill.",3,Credit analyst,malaysia,current,1,5,2,2,2,nice place to learn multitasking,long working hours,12,220,https://malaysia.indeed.com/cmp/Public-Bank-Berhad/reviews?start=220
27 February 2017,Branch - High workload accompanied with good perks,Review from branch based employee 1) Life working in a branch can hardly escape unpaid OT. 2) Software for loans are rather inefficient. 3) Involves a lot of paperwork instead of computerization. 4) Bad management & culture as overly high workload is considered responsibility of staff which is true but no appreciation is noticed for time spent on unpaid OT. 5) Employees are forced to work on Saturday and Sunday without reimbursement. 6) Good bonus and nice colleagues.,2,Credit Officer,Melaka,former,2,4,2,2,2,,,12,220,https://malaysia.indeed.com/cmp/Public-Bank-Berhad/reviews?start=220
2 January 2017,Working at Public Bank,"Overall, I enjoyed every single day of my working day at Public Bank Berhad. This is because, my branch manager and also my colleagues are very supportive and they have helped me on how ti perform my tasks and jobs. The hardest part of my tasks was when I am the clearing department. The most interesting part when I get the chance to help people at from desk and ask on how I can help to do the transactions.",4,Bank Teller,"Bandar Seri Alam, Pasir Gudang",former,4,4,4,4,4,Challenging working experiences,,12,220,https://malaysia.indeed.com/cmp/Public-Bank-Berhad/reviews?start=220
9 December 2016,"Fun work place,team work and lots of banefits","I have been work with public bank for 5 years.This place is so much fun eventhough there are so much work to do.Everyone have their own job and we work as a team to ensure customer satisfied with our service.and also there are a lots of banefits that i get since working with public bank such as cola,healthcare,bonus and increment salary every year.",5,Clerk,Setapak,current,5,5,5,5,5,Bonus,,12,220,https://malaysia.indeed.com/cmp/Public-Bank-Berhad/reviews?start=220
1 December 2016,Informative and management workplace,"Provides informative expertise of financial products and services to external customer in a professional manner. Undergoes training for financial products and services including personal banking, investment banking, sale and management of unit trust funds, and bancassurance. Requires ability to interpret well",4,Sales Executive,"Muar, Johor, Malaysia",former,3,3,4,4,3,,,12,220,https://malaysia.indeed.com/cmp/Public-Bank-Berhad/reviews?start=220
