review_date,review_title,review_body_text,overall_review_rating,job_title,location,employee_flag,rating_work_life_balance,rating_compensation_benefits,rating_job_security_advancement,rating_management,rating_culture_values,pros_text,cons_text,page_number,start_offset,source_url
7 December 2025,Employer of choice for everyone,"I enjoyed the most during work-collaboration with other departments; as this would be the great platform to sharpen my communication skills, knowledge enhancement, grow in self-contidence & maturity and develop good teamwork",5,"Assistant Manager, Recruitment & Sourcing",Kuala Lumpur,former,5,5,5,4,4,"Great place to work, persomal & career growth, & good perks",Frequent re-org/rorg restructuring due to change to the top management,1,0,https://malaysia.indeed.com/cmp/Bank-Rakyat/reviews
13 February 2025,Good,"During my internship at Bank Rakyat, I had the opportunity to gain practical experience in one of Malaysia's leading cooperative banks. I was involved in various aspects of banking operations, such as customer service, handling financial products, and administrative support. This experience allowed me to enhance my communication, teamwork, and problem-solving skills while learning from experienced professionals. It provided me with valuable insights into the cooperative banking sector and contributed significantly to my personal and professional development.",5,Executive,Kuala lumpur,current,0,0,0,0,0,,,1,0,https://malaysia.indeed.com/cmp/Bank-Rakyat/reviews
9 September 2024,Fun and supportive workplace,"During my internship at Bank Rakyat, I had the opportunity to gain practical experience in one of Malaysia's leading cooperative banks. I was involved in various aspects of banking operations, such as customer service, handling financial products, and administrative support. This experience allowed me to enhance my communication, teamwork, and problem-solving skills while learning from experienced professionals. It provided me with valuable insights into the cooperative banking sector and contributed significantly to my personal and professional development.",5,Internship,Kuala Lumpur,former,0,0,0,0,0,,,1,0,https://malaysia.indeed.com/cmp/Bank-Rakyat/reviews
21 July 2024,HR and HQ is OK but CURRENT Manager is TOXIC,. typical day at work is ok . but current manager is toxic . I learn that my current manager only know how to talk . HR and HQ is ok but current manager is toxic . workplace culture not ok because senior behave like intern . the hardest part of the job is current manager is toxic . the most enjoyable part of the job is big bonus and medical expenses fully cover,3,BANK CLERK,Bintulu,current,5,5,5,1,1,big bonus,current manager is toxic,1,0,https://malaysia.indeed.com/cmp/Bank-Rakyat/reviews
17 April 2024,Too much politics,Too much politics issue between bosses which is affected the staff. Benefit overall ok. You have to be “pandai bodek” bos for better career enhancement.,3,Relationship Manager,Shah Alam,current,0,0,0,0,0,,,1,0,https://malaysia.indeed.com/cmp/Bank-Rakyat/reviews
27 February 2024,Great Place for work,great place to start out my career. my supervisor has been very helpful in teaching me the basics of the job to start of in the industry. Helpful colleagues as well and are willing to teach new joiners. office is great and also get to wear casual wear to the office,5,Intern,Bangsar,former,0,0,0,0,0,,,1,0,https://malaysia.indeed.com/cmp/Bank-Rakyat/reviews
26 February 2024,Very productive and fun workplace,"fun environment, less toxic, but not all workplace is perfect, so a little imperfections is acceptable. Staff benefits is very very good in this company. Very recommended to work.",5,Retail Sales Advisor,Kuala Lumpur,current,0,0,0,0,0,,,1,0,https://malaysia.indeed.com/cmp/Bank-Rakyat/reviews
16 January 2024,Productive and very friendly colleagues,"Working at Bank Rakyat as a contract executive for two years was a valuable and enriching experience. Despite the occasional stress, the knowledge gained in the field of financing was immense. The supportive and friendly nature of my colleagues significantly contributed to making the overall work environment positive. One notable aspect of the job was the yearly bonuses, which were exceptionally good. This not only served as a motivating factor but also reflected the organization's commitment to recognizing and rewarding the hard work of its employees. The acceptable overtime policy allowed for a healthy work-life balance, and the collaborative atmosphere within the bank made the workload more manageable. One of the highlights of my time at Bank Rakyat was the willingness of my colleagues to share their knowledge and expertise. The culture encouraged learning from one another, fostering a sense of teamwork and camaraderie. This collaborative approach helped me to navigate the complexities of the job more effectively and ensured a smoother integration into the organizational dynamics. Overall, my experience at Bank Rakyat was not only professionally rewarding but also personally fulfilling. The combination of a supportive work environment, generous bonuses, and the opportunity to learn from experienced colleagues made it a positive chapter in my career.",5,Executive Documentation,Shah Alam,former,4,5,4,4,4,Highly paid bonus and overtime,The system used by everyone is new and nowhere near perfect.,1,0,https://malaysia.indeed.com/cmp/Bank-Rakyat/reviews
14 December 2023,Fun workplace and colleagues,A lot of bonus even for low ranked staff. The bonus will be pro rated for the first year. Supportive colleagues. The system is a little bit old. Office politics are normal.,4,Executive,Kuala Lumpur,current,0,0,0,0,0,,,1,0,https://malaysia.indeed.com/cmp/Bank-Rakyat/reviews
23 May 2023,Toxic work environment,"Everything is okay. Allowance given to interns is satisfactory, however, the work culture is so toxic. People will talk behind your back and it feels like everyone hates eachother.",4,Internship Trainee,Kuala Lumpur,former,0,0,0,0,0,,,1,0,https://malaysia.indeed.com/cmp/Bank-Rakyat/reviews
9 February 2023,fun experience,"definitely fun experience. my supervisor was really helpful and patient with me. but i do not quite favour the late allowance payment as commuting daily to work requires money too and for food, so we do really need the money as much as the employees",4,Intern,Bangsar,former,0,0,0,0,0,,,1,0,https://malaysia.indeed.com/cmp/Bank-Rakyat/reviews
4 November 2022,okay,overall is okay. extra hours working almost everyday and workload. no proper work process strategy. Depend on the branch manager. quite packed schedule in a day,3,executive,sarawak,former,3,4,3,4,3,,,1,0,https://malaysia.indeed.com/cmp/Bank-Rakyat/reviews
5 October 2022,productive and workload,good environment to learn for fresh graduates. work process is a bit slow have to stay for extra hours almost everyday need to improve work flow and process,3,Branch Executive,Sarawak,former,3,4,3,3,3,the benefits,,1,0,https://malaysia.indeed.com/cmp/Bank-Rakyat/reviews
16 August 2022,"Fun, productive and healthy culture","Fun and productive healthy culture. Its depends on the the department you are in but usually they take turn if need to stay back to finish some work. Very friendly, very loving ang supportive eventhough dealing with customer can be very stressfull but the company is so much fun.. Learning alot with my boss",5,TEMPORARY CLERK,Klang,former,5,4,3,5,5,,,1,0,https://malaysia.indeed.com/cmp/Bank-Rakyat/reviews
4 August 2022,Fun and relaxing,But no clear career path for sales scheme. Always hire new people without considering career advancement for existing staff. Overall it is a very pleasant feeling working at bank rakyat,5,SALES,Sungai Buloh,former,3,5,3,3,4,,,1,0,https://malaysia.indeed.com/cmp/Bank-Rakyat/reviews
28 July 2022,Nice colleagues and supervisor,"The workers are friendly but the job scope for an intern is not clearly stated before starting. In my experience, the supervisor will randomly ask to assist the staff in one or two departments they need help with.",5,Intern,Perak,former,3,4,3,3,3,"Have allowance for intern, friendly colleagues",Office politics,1,0,https://malaysia.indeed.com/cmp/Bank-Rakyat/reviews
30 December 2021,Fun and confortable,"so far so good, So enjoyable work with a nice senior staff . Im still under contract for 1 years. n this was for a first month work at BR branch. hopefully can be a permanent staff after the contract end",5,Clerk,Semporna,current,5,4,5,5,0,,,1,0,https://malaysia.indeed.com/cmp/Bank-Rakyat/reviews
13 October 2021,Relaxed Job Culture,"I’am currently serving as a contract clerk in one of the Regional Collection Centre Branches. Yes, the work enviorment is very relaxed becuse 85% of the employees in the office are family people and senior citizens whom have serviced not less than 5 years with the bank. Communication among staffs and management are good but somehow there will be always 1-2 senior staffs whom disagrees everything the boss does or said (very strong in employee rights/unions stuff). Other than that, since its a 100% Malay culture, laziness is there but the act of good in properous meal ‘belanja’ always being done weekly by any of the kind-hearted staffs other than staffs are helpfull among each other. Salary wise for a diploma range contract staff is kind off sad for its figure but atleast the annual bonuses, ex-gratia payouts and claims are elidgable (as per permanent staffs) for service not less than 6 months on the day of the bonus announcement date via email. Even so, in day 2 of reporting, one of the staff recommended me to apply Staff Credit Card (I never had any credit card before) and guess what? They approved for a handsome limit of the card compared to my salary 😂. In conclusion, working with Bank Rakyat is fun and nice place to work just like any other conpanies but the con’s is always there and it depends on how you deal with it professionally.",5,Contract General Clerk,Shah Alam,current,5,5,4,5,5,"Free lunches (belanja by bosses and senior staffs on a monthly basis), Good staff credit card apporoval limits, Unlimited claims (as long your pengurus cawangan acknowledges it), Staff hotel benefit rates for holidays, Annual Bonuses, Ex-Gratia Payouts, Claimable Medical Bills (certain minor cases), Very religious islamic Staffs and Helpfull staffs","Certain staffs are lazy, Kaki kipas staffs, Low salary start up for contracted staffs",1,0,https://malaysia.indeed.com/cmp/Bank-Rakyat/reviews
3 March 2020,good,good culture..mostly staff will helpneach other to achieve branch target. good team work. good team leader. good product. good working environment. good staff benefit.,4,sales exec,Gombak,former,3,3,3,3,3,,,1,0,https://malaysia.indeed.com/cmp/Bank-Rakyat/reviews
20 November 2019,culture,culture in workplace is enjoyed and peaceful no stressful an very relax.Hope can get the job in shariah department and can get along with member in my old department again,3,Executive in Financial Planning Department,Kuala Lumpur,former,0,0,0,0,0,,,1,0,https://malaysia.indeed.com/cmp/Bank-Rakyat/reviews
4 October 2019,Seller about product bank rakyat,Trying to sales all product from bank rakyat especially financing loan and housing loan from bank rakyat. I'm also helping for those people have a financing problem and trying to solve their money problem with reschedule their financing. I'm also had a target to achieve every month with certain product from bank rakyat.,4,Sales executive,Petaling,former,4,4,4,4,4,,,2,20,https://malaysia.indeed.com/cmp/Bank-Rakyat/reviews?start=20
26 September 2019,Good for Fresh Grads,"The working environment is a good place or start up for fresh graduates that looking for first working experiences, relax working environment and reasonable wages for fresh graduates.",5,Debt Collector,Kuala Lumpur,former,5,3,5,3,5,Islamic Culture,Lack of perks,2,20,https://malaysia.indeed.com/cmp/Bank-Rakyat/reviews?start=20
29 August 2019,Productive and Work-Life Balance,The culture of this company is great and conducive to work also everyone is very helpful in solving my tasks and gaining knowledge even I am not from the department.,5,Intern Trainee,Kuala Lumpur,former,5,5,5,5,5,,,2,20,https://malaysia.indeed.com/cmp/Bank-Rakyat/reviews?start=20
25 July 2019,Good Bank,'- Good experience in bank industry. - Learn how to be professional. - Good management and team. - Strategic place in Bangi. - Enjoy with people and customer.,5,Industrial Training,Bangi,former,0,0,0,0,0,,,2,20,https://malaysia.indeed.com/cmp/Bank-Rakyat/reviews?start=20
12 May 2019,"Productive and fun, friendly colleagues",Good guidance from colleagues and learned many new thing also polish my ability to work under pressure. Workplace was great and I am able to be on department rotation which helped me expose to several new things.,5,Internship (3 months),Kuala Lumpur,former,4,5,4,4,5,,,2,20,https://malaysia.indeed.com/cmp/Bank-Rakyat/reviews?start=20
8 April 2019,Fun place to work,"Good environtment,nice place,strategic place near mrt.easy to find place for lunch, nice co worker.dress code is easy. Training provided.easy parking.",5,Telecollector,Bangsar,current,3,3,2,3,4,Comfortable and strategic place near mrt,No career growth,2,20,https://malaysia.indeed.com/cmp/Bank-Rakyat/reviews?start=20
25 March 2019,Objective,"Individual with a good reputation looking to work at your company , bringing strong ability to ashere to rules and regulations guiding the company, and also obey legal laws un the process of working for the company",5,Personal Financial Consultant,Sibu,former,4,5,5,5,5,More activies on weekend like family day,Office hour..,2,20,https://malaysia.indeed.com/cmp/Bank-Rakyat/reviews?start=20
8 March 2019,Happy workplace,Provide a good happy peaceful work place . All staff are always help each other and have a good communication with others. Provide foodcourt for staff.,5,TELLE - COLLECTOR,Kuala Lumpur,former,5,5,5,5,5,,,2,20,https://malaysia.indeed.com/cmp/Bank-Rakyat/reviews?start=20
11 October 2018,Good Employer,Have a nice memory with bank rakyat. A very good environment. Easy to coorperate with staff. Very supportive employer. Willing to help when needed. I'm happy working in bank rakyat.,5,Sales Executive,Petaling Jaya,former,3,3,3,5,5,,,2,20,https://malaysia.indeed.com/cmp/Bank-Rakyat/reviews?start=20
25 August 2018,Im enjoy work at bank rakyat but im contract for 2 years,Im manage for customer stamping after loan. Im also secetery my Boss and admin to all staff. Last part my job is customer service and answer call customer.,5,CLERK,"TAWAU,KOTA KINABALU",former,5,5,5,5,5,"Heatcare, Annual Bonus, Raya Bonus;Benefit",,2,20,https://malaysia.indeed.com/cmp/Bank-Rakyat/reviews?start=20
6 August 2018,Hamonious working atmosphere,Work in a calm and harmonious atmosphere. Comfortable office space and various amenities are available.Sport club facilities and various activities are organized. Medical benefits for employees and family member,3,CLERK,Kuala Lumpur,current,4,3,4,2,4,"Medical, Sports and Activities Club",Promotion Gred and Post,2,20,https://malaysia.indeed.com/cmp/Bank-Rakyat/reviews?start=20
20 May 2018,convenient workplace,"As a practical student, i need to expose myself in every department in the bank. Thus, it helped me a lot to gain knowledge and experiences. The management there were very good.",5,PRACTICAL STUDENT,Kerteh,former,5,5,5,5,5,near home,short time,2,20,https://malaysia.indeed.com/cmp/Bank-Rakyat/reviews?start=20
14 May 2018,Friendly environment,"Colleague are really helpful. Willing to teach me when I don't understand anything. I learned a lot from them.Hence, I am familiar with banking sector. My communication skills got better as I always communicate with customer.",5,Trainee,Kedah,former,5,5,5,5,5,,,2,20,https://malaysia.indeed.com/cmp/Bank-Rakyat/reviews?start=20
11 April 2018,Productive work place with faster disburse loan,"The work surrounding is good, I mean the employees, the employer and the computer system is good. I have learnt how to attend customers when they want make a loan, how to prepare all loan's document, how to attract customer to make loan with bank rakyat, how to calculate how much loan that customers want, how to key in in the system and how to blast sms about loan to customers. The hardest job is when customers argue the rate of personal loan or other loan, because they will compare to other bank and then they do not want to make it loan and they will go other bank. We can not make something because we only can pursue and slowly talk about advantage of bank rakyat for example, bank rakyat can approve personal loan in one day and customers will get the money by that day. The quality of process is very effective that we can use as our strong argue when customers want to switch at other bank. Several bank make their loan in 2 weeks. Only bank rakyat can make within 3 hours or one day by typical.",5,ISLAMIC BANKING,Jelutong,current,5,5,5,5,5,Boss treat all staff lunch every week on friday,There are several people there are lazy to work,2,20,https://malaysia.indeed.com/cmp/Bank-Rakyat/reviews?start=20
20 March 2018,work culture at my previous company,"I learn a lot about the real work culture which is in my previous company that i work they teach me how to attend customer,how to calculate the eligibility the customer to make personal loan,how to build a good relationship ,how to achieve sales target,how to market the product.",5,Marketing Executive,George Town,former,4,4,4,4,4,Flexible time,the benefit,2,20,https://malaysia.indeed.com/cmp/Bank-Rakyat/reviews?start=20
19 March 2018,Productive and fun working environment,"As an internship student, the staffs being very helpful in teaching me knowledge and skills in doing the task given. I was assigned to three units at the branch and learned all the skills and experience there really helped me in viewing my future in this field.",5,IIUCS internship program,"Setapak, KL, Malaysia",former,5,5,5,5,5,,,2,20,https://malaysia.indeed.com/cmp/Bank-Rakyat/reviews?start=20
10 March 2018,Knowing how the bank operates it,the culture at work are great. the most enjoyable job at Bank raykat is knowing how the employee attend the customer. There's no have a typical day at work. The management at work is good,4,Internship,Kajang,former,4,4,5,4,4,,,2,20,https://malaysia.indeed.com/cmp/Bank-Rakyat/reviews?start=20
5 March 2018,enjoy work at there,enjoy work with the culture and management. flexible time and many program to join and get new experience and learn the something new knowledge. tolerance and good cooperation.,3,Marketing Executive (BR smart),kulim,current,3,3,4,4,4,flexible time,rilex,2,20,https://malaysia.indeed.com/cmp/Bank-Rakyat/reviews?start=20
26 January 2018,happy workplace,"processing the personal loan, attend customer and inform customer if loan has been approve . Few terms and condition should be fulfill by customer themselves before the loan can be approve. helpful colleague and happy working environment",4,Personal Loan Processor,Perak,current,4,4,4,4,4,happy workplace,contract position,2,20,https://malaysia.indeed.com/cmp/Bank-Rakyat/reviews?start=20
9 January 2018,Marketing,I work every day is making marketing of personal financing products. I work more online and do marketing in the public office. What I learned during my work with the federal bank was how to deal with different payload customers. the way management is to ensure the best service to the customer according to the promised time. My workplace culture is very lively. work productively and ensure achievement can be targeted. The difficult part of working alongside is when you want to get information from customers who are out of the area who do not have a good line like in the interior. but can be solved by meeting with customers. what I like during my work is to make a marketing that is a lot of walking and going out to many people.,5,MARKETING EXECUTIVE,Sabah,current,4,5,5,5,5,enjoy,faced with the risk of accidents on the road,2,20,https://malaysia.indeed.com/cmp/Bank-Rakyat/reviews?start=20
30 December 2017,Good environment workplace with dynamic team work.,"Job spec, manage customer's loan application and meet customer for sign agreement and open account. Learn in communication with customer and can work under pressure Workplace culture, work in team, dynamic team player, and achieving target The hardest part of the job, is achieving target of Personal Loan for 200k in 3 weeks. The most enjoyable part of job is meet new people, fun workplace and had a good teamwork.",4,Pegawai Pemasaran Br Smart (TRAINER),lukut,current,5,3,4,5,5,"good management, lunch and trip","medical cards, benefits, salary/allowance",3,40,https://malaysia.indeed.com/cmp/Bank-Rakyat/reviews?start=40
25 December 2017,Cheerful work place,"During my previous working, I was needed to deal with the customers and to smoothen out the works for my higher ups. I also was able to intensify my skill in using Microsoft Office especially Word and Excel. I learnt how to work in a team in order to deliver organization's goals.",5,Sales executive,"Raub, Pahang",former,5,5,5,5,5,Very flexible working time,Short break,3,40,https://malaysia.indeed.com/cmp/Bank-Rakyat/reviews?start=40
10 December 2017,Good Management,"I work at Bank Rakyat as a Br Smart. Everyday I will go out to do a marketing or promotion of Bank Rakyat products like Personal Financing, Takaful Amani, Wasiat and Credit Card. What i have learned in this job is I learned how to handle customers and any problems that arise along I work at Bank Rakyat and I learned how communicate good with customers.The management of Bank Rakyat is good. I really like the workplace culture, all staff is kind and work together to solve problems. The hardest part I do is to explain something that is not in my job scope to customer that very angry to Bank Rakyat. The most enjoyable part of the job is the time of work is flexible.",5,BR SMART,"KUALA KANGSAR,PERAK",former,5,4,5,5,5,Flexible Time,NO Medical Card provide to Br Smart,3,40,https://malaysia.indeed.com/cmp/Bank-Rakyat/reviews?start=40
6 December 2017,Staff friendly and helpful,"Responsibilities to carry out marketing and sales financing products and services of the Bank. Ensure that sales targets set for financing Aslah, wills and other incentive-based product sales.",4,BR SMART,Perak,former,4,4,4,4,4,Income based on sales,No privacy time,3,40,https://malaysia.indeed.com/cmp/Bank-Rakyat/reviews?start=40
29 November 2017,Good working environment,I got guidance from a very good staff. I learn how to perform compliance assessment/checklist on proposal paper that introduces new or variance product and services prior to launch. I am also learn to prepare periodic monthly reports and ad-hoc compliance reports on the status of product/services being submitted to BNM,5,INTERN,Kuala Lumpur,former,4,4,5,4,5,,,3,40,https://malaysia.indeed.com/cmp/Bank-Rakyat/reviews?start=40
31 October 2017,experienced,i gain a lot of experienced there. they give me opportunity to entertain customer who want apply for personal loan. the hardest part of job is to calculate customer salary.,4,BR smart,Seremban,former,4,4,4,4,4,,,3,40,https://malaysia.indeed.com/cmp/Bank-Rakyat/reviews?start=40
28 October 2017,progressive and dynamic organizations,Participated with documentation process and perform daily work. Assisted customers queries regarding financing. I am also handling and participated for any event held by Bank Rakyat as well as doing an administration work.,4,PRACTICAL STUDENT,Mersing,former,4,4,4,4,4,,,3,40,https://malaysia.indeed.com/cmp/Bank-Rakyat/reviews?start=40
3 October 2017,Good,'- Everyday is challenging because need to find sales. - I learned about Bank Rakyat S'ban services and improved my soft skills. - The management is quite good. - The workplace culture is average. - The hardest part of the job is to find for sales. - The most enjoyable part of the job is I got to meet different types of people.,4,Sales Agent,Seremban,former,3,3,3,3,3,,,3,40,https://malaysia.indeed.com/cmp/Bank-Rakyat/reviews?start=40
29 September 2017,Good Employee,"Since this company in financial field, all workers here are very hardworking person. They always make their job as their priority and served best services to their customers. When dealing with customers, they will make sure that customers will satisfied with their services. If they have any event they will always give their cooperation without being selfish. They also teached me how communicate with customers and handling the customers. I also learn how to settle the problems by my ownself.",4,Internship,Baling,former,5,5,5,5,5,Allowance,None,3,40,https://malaysia.indeed.com/cmp/Bank-Rakyat/reviews?start=40
9 September 2017,Productive and Good teamwork,I get many of experiences. I learn how to handle a lot of customer at that time. I learn backwork processes in bank. I also known about financing personal and home financing.,5,Temporary Clerk,Kepala Batas,former,5,3,5,4,4,,,3,40,https://malaysia.indeed.com/cmp/Bank-Rakyat/reviews?start=40
4 September 2017,Productive and interesting,"A typical day at work when Monday and Friday because many customer at bank. But i can help operation unit for easy their work. I learned how to manage a lots of customer, how to treat customer in everything case. I so interesting when as a customer services at this bank because i get many of experiences.",5,Temporary Clerk,Kepala Batas,former,4,4,5,4,4,,,3,40,https://malaysia.indeed.com/cmp/Bank-Rakyat/reviews?start=40
