review_date,review_title,review_body_text,overall_review_rating,job_title,location,employee_flag,rating_work_life_balance,rating_compensation_benefits,rating_job_security_advancement,rating_management,rating_culture_values,pros_text,cons_text,page_number,start_offset,source_url
27 February 2024,"No positive reviews, no work life balance. Everything is about selling","No positive reviews, no work life balance. Everything is about selling here. You don’t get commission for during cross selling. Except for clericals every other officers has to do cross selling like saving accounts and so on.",2,Credit analyst,Setapak,current,0,0,0,0,0,,,3,40,https://malaysia.indeed.com/cmp/Public-Bank-Berhad/reviews?start=40
20 February 2024,Long working hours,"Long working hours without pay, old school, very traditional company, a lot of paperworks, system always hang especially in the evening… nothing good except the benefits like increment and bonus and low interest on HL and HP..",3,Credit Analyst,Kuala Lumpur,current,0,0,0,0,0,,,3,40,https://malaysia.indeed.com/cmp/Public-Bank-Berhad/reviews?start=40
14 February 2024,Long working hours,"Expect long working hours. That being said, you get to learn a great deal about mortgages, banking and lending. Structured training is provided as well.",4,Credit Analyst,Johor,former,0,0,0,0,0,,,3,40,https://malaysia.indeed.com/cmp/Public-Bank-Berhad/reviews?start=40
8 February 2024,"Great salary, bonus and increment","Im involved in HP. First of all, the position is quite hardcore. You are expected to go beyond ur KPI. The workload is quite heavy, but by time ull get used to it. The great thing about the position, is the pay, bonuses and increment. Overall its a great place to learn. But be ready to work long hours, as it is the norm here.",5,Credit analyst,Negeri Sembilan,current,0,0,0,0,0,,,3,40,https://malaysia.indeed.com/cmp/Public-Bank-Berhad/reviews?start=40
6 February 2024,Not a good place unless you're willing to do anything for money,"'-No guidance given to newbies -No OT payment but expected to OT every single day -Toxic work environment, you just sit down for 9 hours and stay glued at your screen, and everybody hates it if you take a quick break to the toilet, or suggest any new approaches -Please digitalize the processes in credit as the bank is outdated in this expect, please look at other competitors.",2,Management Trainee (credit),Selangor,former,0,0,0,0,0,,,3,40,https://malaysia.indeed.com/cmp/Public-Bank-Berhad/reviews?start=40
25 January 2024,Old structure of company,Stress working environment High work load Need to work over time to finish the work but no pay OT Colleagues is helpful and friendly Low opportunity for career growth,4,Credit Analyst,Malaysia,former,0,0,0,0,0,,,3,40,https://malaysia.indeed.com/cmp/Public-Bank-Berhad/reviews?start=40
23 January 2024,Good for beginner,Colleague are nice. But too much paperwork and need to work until 8pm everyday due to culture. Culture depend on managers. They have too much power and no one can question them.,3,senior executive,Perak,current,0,0,0,0,0,,,3,40,https://malaysia.indeed.com/cmp/Public-Bank-Berhad/reviews?start=40
22 January 2024,High pay with great benefits but expect to work a lot,No work-life balance. Year-end bonus is very generous. 24 days of annual leave. Good place to start for fresh graduates but long working hours. Office is old.,3,Management Trainee,Maluri,current,0,0,0,0,0,,,4,60,https://malaysia.indeed.com/cmp/Public-Bank-Berhad/reviews?start=60
17 January 2024,No OT Overall not bad,"Maybe it's just this branch do not have much OT, normally we back at 6pm. Annual leave 24 days. Colleagues are friendly, have to service with a lot of walk in customers, normally you can only start your works after 4pm",4,Management Trainee,Selangor,former,0,0,0,0,0,,,4,60,https://malaysia.indeed.com/cmp/Public-Bank-Berhad/reviews?start=60
8 January 2024,High Salary,"Good place to start for fresh graduates, offers a high starting salary but very long working hours. Going back at 10 pm is normal, 7 pm is the earliest time to go home, weekend sometimes need to work also, work-life balance? Don't even think about it. but offer a high salary, 24 AL, medical coverage, and a bonus.",3,Senior Executive,Kuala Terengganu,former,0,0,0,0,0,,,4,60,https://malaysia.indeed.com/cmp/Public-Bank-Berhad/reviews?start=60
27 December 2023,Competitive enviromemt,Good for fresh grad but very stressful long working hours but good benefit and high salary if you are looking for a challange this is a good place to start,5,Marketing executive,Kota Damansara,current,0,0,0,0,0,,,4,60,https://malaysia.indeed.com/cmp/Public-Bank-Berhad/reviews?start=60
26 December 2023,"Good Benefits, abysmal office","The benefits is one of the best in the industry. Staff Housing Loan, 24 days AL, Year end Bonus & Exgratia Bonus. The office is old. and not good. Have to chip in money for a Brand new water filter. :')",3,Analyst Programmer,Bangi,former,0,0,0,0,0,,,4,60,https://malaysia.indeed.com/cmp/Public-Bank-Berhad/reviews?start=60
12 December 2023,Boring workplace,Chinaman company with conservative mindset. But the annual increment and bonus is good. Just the management side need to improve. The longer u work the highest bonus will get,4,senior compliance executive,Kuala Lumpur,current,0,0,0,0,0,,,4,60,https://malaysia.indeed.com/cmp/Public-Bank-Berhad/reviews?start=60
10 December 2023,Challenge but good for fresh graduate,"Pros -Able to learn a lot of new things -Friendly staff -Lot of training provided -Good Management and culture Cons -Challenge for hit target, long working hrs.",4,Marketing,Kota Kinabalu,current,0,0,0,0,0,,,4,60,https://malaysia.indeed.com/cmp/Public-Bank-Berhad/reviews?start=60
27 November 2023,Fun environment,"Fun and enjoy environment , great to explore more finance product , can increase knowledge …… Just increament for sales staff are base on personal performance",4,Sales,Selangor,former,0,0,0,0,0,,,4,60,https://malaysia.indeed.com/cmp/Public-Bank-Berhad/reviews?start=60
21 November 2023,It was OK?,"working there was a good experience overall, but it is important to first make sure you research the branch that you are assign to so that you can get a general idea of what kind of demographic you will sell the product to.",4,Bancaassurance,Klang,former,0,0,0,0,0,,,4,60,https://malaysia.indeed.com/cmp/Public-Bank-Berhad/reviews?start=60
13 November 2023,Fun workplace,Good to gain experience for new fresh graduate. Enjoy workplace with friendly colleague and good boss. Be able to increase skill in self independent too,5,Senior Sales & Marketing Executive,Kuala Lumpur,current,0,0,0,0,0,,,4,60,https://malaysia.indeed.com/cmp/Public-Bank-Berhad/reviews?start=60
11 November 2023,Productive and fun working space,"Colleagues are very friendly and willing to help. But is quite stressful to hit KPI every month, branch manager will give pressure when all meeting weekly",5,Senior Financial Executives,Desa Cemerlang,former,0,0,0,0,0,,,4,60,https://malaysia.indeed.com/cmp/Public-Bank-Berhad/reviews?start=60
2 November 2023,Graduates may try which is a place to train working in pressure environment,What is the best part of working at the company? heavy workload and without work life balance What is the most stressful part about working at the company? No solutions when facing problems,1,Hire Purchase Analyst,Johor,current,0,0,0,0,0,,,4,60,https://malaysia.indeed.com/cmp/Public-Bank-Berhad/reviews?start=60
2 November 2023,Credit analyst,Maybe is good to work for do not have any directions to run yourself，of course not suitable for all depends how many stressful you can handle it on you,3,Credit analyst,Ipoh,former,0,0,0,0,0,,,4,60,https://malaysia.indeed.com/cmp/Public-Bank-Berhad/reviews?start=60
29 October 2023,Toxic People and Unfair Treatment,Good salary and increment but you need to face toxic people. Staff benefits seems is good but actually nope. I think clerical is benefits most in the company compare with the officer.,3,Assistant Manager,Kuala Lumpur,current,0,0,0,0,0,,,4,60,https://malaysia.indeed.com/cmp/Public-Bank-Berhad/reviews?start=60
24 October 2023,Good benefits,"Overall great place to work. Good increment, good benefits, good bonus. Promotion after 3-4 years. Health benefit also ok. Sometimes boss have favouritism.",5,Analyst,Kuala Lumpur,current,0,0,0,0,0,,,4,60,https://malaysia.indeed.com/cmp/Public-Bank-Berhad/reviews?start=60
17 October 2023,Job security but with hard work,Good job security but need to able to handle the big work load. Bonuses are good with decent increment if company is profitable at the end of the year.,5,Senior Operations Officer,Kota Kinabalu,former,0,0,0,0,0,,,4,60,https://malaysia.indeed.com/cmp/Public-Bank-Berhad/reviews?start=60
11 October 2023,Good place to learn,Good salary increment and bonus Increase knowledge and peoples skills Manage time Heavy workloads and high targets OT almost every weekdays and work on weekends,4,Senior sales and marketing executives,Kedah,former,0,0,0,0,0,,,4,60,https://malaysia.indeed.com/cmp/Public-Bank-Berhad/reviews?start=60
5 October 2023,nice working environment,friendly and nice working environment. colleagues are helpful enough to assist and guide. direct and clear career path yet systems are bad and outdated,5,sales,Kuala Lumpur,former,0,0,0,0,0,,,4,60,https://malaysia.indeed.com/cmp/Public-Bank-Berhad/reviews?start=60
29 September 2023,Fun and stress,"Need to achieve target every month. If not, then will be meeting of low performance. Always need to report what have we done in the branch and so on.",5,Senior financial executive,Melaka,current,0,0,0,0,0,,,4,60,https://malaysia.indeed.com/cmp/Public-Bank-Berhad/reviews?start=60
17 September 2023,Fun workplace,Lot to learn and good onsite training. Exposed to credit and operational at branch and HQ exposure. Lot pressure for sales but good boss (young lady) and nice teammate,5,Senior Executive,Kuala Lumpur,former,0,0,0,0,0,,,4,60,https://malaysia.indeed.com/cmp/Public-Bank-Berhad/reviews?start=60
12 September 2023,Not bad,"Heavy workload, but good salary and benefits... Helpful and kind colleagues Stressful work environment Expected OT Iffy Career Development (Promotions) Not bad Overall",3,CREDIT RISK MODELLER,HQ,former,0,0,0,0,0,,,5,80,https://malaysia.indeed.com/cmp/Public-Bank-Berhad/reviews?start=80
10 September 2023,Old school company,Outdated technology with school-like management. Expect workers to overtime without paying. Not environmentally friendly as everything must be printed on paper including email?!!!,1,Management Trainee,Kuala Lumpur,former,0,0,0,0,0,,,5,80,https://malaysia.indeed.com/cmp/Public-Bank-Berhad/reviews?start=80
11 August 2023,Attractive benefits. And good commission payout if your sales is good,"Unhealthy work environment, not helpful colleagues. Lack of teamwork. Good benefits have commission and bonus Both. And very flexible working environment because have an understanding Branch manager.",3,Senior financial executive,Seremban,current,0,0,0,0,0,,,5,80,https://malaysia.indeed.com/cmp/Public-Bank-Berhad/reviews?start=80
4 August 2023,Typical company you can think of.,"Worked at back office. The furniture was old and the bank rarely change the furniture. They will just fix as much as they can. The chair can be dusty and full of suspicious patches but as long as it serves the purpose, they won’t bother to improve. Working there was good in terms of learning, but at one point,if you’re not actively contributing ideas,you won’t stand out. But if you do,can be frustrated as well because the culture there(depends on department) was to promote based on seniority. The management might be the same as other company, could be frustrating dealing with them and okay at the same time. Depends on how you view the situation.",3,Assistant Manager,Kuala Lumpur,former,0,0,0,0,0,,,5,80,https://malaysia.indeed.com/cmp/Public-Bank-Berhad/reviews?start=80
3 August 2023,Good Pay and Benefits,"Good pay in bonus, unlimited medical benefit for staff and family, surrounded by klcc area which makes a lot of choices of eateries. Heavy workloads, no appreciation from management, unfair treatment from management team, no work life balance.",4,Assistant Manager,Kuala Lumpur,former,0,0,0,0,0,,,5,80,https://malaysia.indeed.com/cmp/Public-Bank-Berhad/reviews?start=80
25 July 2023,"Not a good place for fresh graduates, system is outdated and many manual works","Try to find for other alternative instead of joint the MT program, there is no rotation for work. If you are lucky, you will meet those good and kind seniors to guide you, if not, you will be scolded for asking.",3,Mt,malaysia,former,0,0,0,0,0,,,5,80,https://malaysia.indeed.com/cmp/Public-Bank-Berhad/reviews?start=80
25 July 2023,Competitive Benefits,"Working here is great, depends on your team. If your team is OK then your mental is OK, if not otherwise. Good salaries and benefits. Bonus is quite a lot depends on your performance and bank performance.",3,Security Analyst,Kuala Lumpur,former,0,0,0,0,0,,,5,80,https://malaysia.indeed.com/cmp/Public-Bank-Berhad/reviews?start=80
10 July 2023,Bancassurance Sales,Public Bank has a lot of good employee benefits. The working environment is highly dependent on which branch you are working at some are great while some are less great. If you do plan on working for public bank be prepared physically and mentally.,3,financial executive,Melaka,current,0,0,0,0,0,,,5,80,https://malaysia.indeed.com/cmp/Public-Bank-Berhad/reviews?start=80
28 June 2023,Not the management trainee program you expect,"Normally, management trainee program is meant to train you to become a manager. but here at public bank, it does not seem like it. i would say the job scope is relatively easy, i dont understand why they need degree holder for this job",3,Management Trainee,Kuala Lumpur,former,0,0,0,0,0,,,5,80,https://malaysia.indeed.com/cmp/Public-Bank-Berhad/reviews?start=80
22 June 2023,No Work Life Balance,"Very Boring, as the management has require you to work overtime. Collegue are good very helpful, but too traditional minded. The environment is depend on the branch",3,Credit Analyst,Kuala Lumpur,former,0,0,0,0,0,,,5,80,https://malaysia.indeed.com/cmp/Public-Bank-Berhad/reviews?start=80
16 June 2023,stress workplace,"need to work long hours, high target, lack of guidance, pay is not high, customer is not bad but most of the time you are dealing with car dealer. need to work on weekends",3,senior sales and marketing,kuala lumpur,former,0,0,0,0,0,,,5,80,https://malaysia.indeed.com/cmp/Public-Bank-Berhad/reviews?start=80
15 June 2023,Good remuneration if you perform,"Generally a great place for you to jump in. Good bonuses, cheap staff loan and health benefits. Rewards loyalty. If you enjoy hectic working environment, this may be the place for you. Generally the process is still manual.",4,Assistant Manager,Kuala Lumpur,current,0,0,0,0,0,,,5,80,https://malaysia.indeed.com/cmp/Public-Bank-Berhad/reviews?start=80
7 June 2023,Intensive and great workplace,"Intense and demanding workplace, often stayback post working hours but your boss will remunerate you accordingly based on your efforts and initiatives",5,Risk,KL,former,0,0,0,0,0,,,5,80,https://malaysia.indeed.com/cmp/Public-Bank-Berhad/reviews?start=80
13 May 2023,Productive and efficient,"As a compliance, you have to go through a lot of standards procedure by following the rules and regulations of Public Bank. Have to ensure that the reports are written accurately. There is a lot of OT hours to be spent too.",5,Compliance Officer,Kuala Lumpur,former,0,0,0,0,0,,,5,80,https://malaysia.indeed.com/cmp/Public-Bank-Berhad/reviews?start=80
13 May 2023,Stressful environment and always need to deal with high workload,"Bad working culture, work for 12 hours per day and need to go back office on weekend&on leave. Manager will force you to go back to process case and no one is going to be your relief when you're on leave.",1,Hire Purchase Credit Analyst,Taman maluri,former,0,0,0,0,0,,,5,80,https://malaysia.indeed.com/cmp/Public-Bank-Berhad/reviews?start=80
11 May 2023,China man company,"Require to OT to prove u are efficient. Not sure if only subject to my department. Benefit not bad, contractual bonus and good colleague ( although not all)",3,Senior executive,Kuala Lumpur,former,0,0,0,0,0,,,5,80,https://malaysia.indeed.com/cmp/Public-Bank-Berhad/reviews?start=80
11 May 2023,Toxic environment,Hard to climb corporate ladder. Toxic environment. Normal increment. No toilet papers provided in washroom. Need to multitask and overtime. No OT provided.,1,Senior Executive,Kuala Lumpur,former,0,0,0,0,0,,,5,80,https://malaysia.indeed.com/cmp/Public-Bank-Berhad/reviews?start=80
8 May 2023,Good workplace but slow progression,Good learning curve for fresh graduates but slow career advancement. System is very manual and slow compared to other companies using latest technology,3,Senior Executive,Kuala Lumpur,current,0,0,0,0,0,,,5,80,https://malaysia.indeed.com/cmp/Public-Bank-Berhad/reviews?start=80
3 May 2023,Good staff benefit with poor management,Management doesn't care about you. You just need to do work. Their work process keep changing. But benefits is quite good. Annual leave higher than others company.,4,Analyst programmer,Selangor,former,3,3,3,2,2,"Unlimited(hospital warded), 6month maternity leave(3month full day, 3month half pay)","Standby call during midnight(2 to 5 times) per month, OT claim not worth it, going back late is almost everyday(before 9pm is still considered early)",5,80,https://malaysia.indeed.com/cmp/Public-Bank-Berhad/reviews?start=80
20 April 2023,Great place to start your career especially fresh grads,"Colleagues are helpful, manager and branch manager is supportive, depends which branch you get. Benefits and annual leaves are good. Almost perfect. You just have to be strong and adaptive to work with older generations.",5,Senior Credit Analyst,Kuala Lumpur,current,0,0,0,0,0,,,5,80,https://malaysia.indeed.com/cmp/Public-Bank-Berhad/reviews?start=80
20 April 2023,Good benefit,"Public bank is one of the bank that provides good staff benefit, including all kind of allowances, and staff loan. Inventive payout is generous too. Alot of campaigns for staff to participate in.",5,Senior Financial Executive,Sarawak,former,4,5,3,4,4,,,6,100,https://malaysia.indeed.com/cmp/Public-Bank-Berhad/reviews?start=100
8 April 2023,Productive and fun workplace,"The positive aspects A good wage increase on top of bonuses, in addition to the standard provision of staff loans for automobiles, housing, and other specialised purposes. The obstacles to overcome Since the current boss used to be a secretary and has no prior experience in management, working hours have increased since the previous boss departed the company.",5,Senior Executive,Kuala Lumpur,current,0,0,0,0,0,,,6,100,https://malaysia.indeed.com/cmp/Public-Bank-Berhad/reviews?start=100
1 April 2023,Salary wise okey,If you want higher salary than other bank for fresh grad okeyy if not don't join. Workload too much Environment quite toxic especially with the older colleagues The training is quite insufficient as u have to try to self learn a lot,3,Senior executive operation,Jinjang,current,0,0,0,0,0,,,6,100,https://malaysia.indeed.com/cmp/Public-Bank-Berhad/reviews?start=100
29 March 2023,"Rigid corporate structure, top to down management style","Outdated management style. Top management inflexible when it comes to opinion from junior. End result is younger talents will likely jump ship while those who just follow orders passively will be rewarded or promoted by the top management. Whilst corporate life do not usually favor the creative minded ppl, rigid management will result in unproductive and unecessary workload at the end of the day. Benefit wise is comparable to other bank. Bonus structure is standard at 2month years end plus up to 4 month performance bonus in a year for normal office job while those in sales can expect double, triple and even more.",5,Assistant manager,Ampang,current,0,0,0,0,0,,,6,100,https://malaysia.indeed.com/cmp/Public-Bank-Berhad/reviews?start=100
20 March 2023,Bad experience,"bad working culture, large age gap if u were allocated in the branch. Besides your job scope, have to work as a customer service officer, and also have a large proportion of administration work.",1,Management Trainee,Kuala Lumpur,former,0,0,0,0,0,,,6,100,https://malaysia.indeed.com/cmp/Public-Bank-Berhad/reviews?start=100
20 March 2023,"Good colleagues, old school management",1. Good colleagues and all helpful. Can refer to them whenever in doubt 2. No proper knowledge transfer 3. Too much hierarchy 4. Too much SOP for everything,4,Analyst Programmer,Bangi,current,0,0,0,0,0,,,6,100,https://malaysia.indeed.com/cmp/Public-Bank-Berhad/reviews?start=100
22 February 2023,No career progress,"Sick management. Staff promotion depend on Manager. When you got the chance to promote, manager declined it by not lettting staff to transfer. Many lazy staff in the branch.",3,Credit analyst,Selangor,current,0,0,0,0,0,,,6,100,https://malaysia.indeed.com/cmp/Public-Bank-Berhad/reviews?start=100
7 February 2023,Close minded company,"Everything depends on your team, learning opportunities, working culture, etc. SOP is very strict, everything requires your superior to get approval from management, for example: internet access, tools, etc.",3,Analyst Programmer,Bangi,former,3,3,1,3,2,,Long working hour,6,100,https://malaysia.indeed.com/cmp/Public-Bank-Berhad/reviews?start=100
12 January 2023,Bad working environment,High volumes Seniors are unwilling to teach & help. Managers - some old folks who is bad with computer (don't even know how to use excel...print out reports to check & use long ruler to check the alignment...) Gosh...,2,Management Trainee,Kuala Lumpur,former,0,0,0,0,0,,,6,100,https://malaysia.indeed.com/cmp/Public-Bank-Berhad/reviews?start=100
12 January 2023,They have a very bad work life balance for any job that is in the Hire Purchase Department unless you are applying for a clerk position,"They hope that you work more than the scheduled work hours and they do not compensate for OT, and the management (Hire Purchase Department) hate to see that their workers go back on time even if you have completed your work you still need to act busy and then go back at 8pm or 9 pm (schedule working hours are 8.45am - 5.45pm). If you think that bank benefits are good, you are wrong too, the benefits are all the same with any established companies just the extra thing is that if you work with them you will easily get loans from them, but then again they're pay is not high and the loan benefit is just basically paying back to the people who pays you to work there, and they receive your money with interest, is a win-win situation for them. You will get special housing loan rate with them but if you quit your job your housing interest will increase back to any normal people's interest rate. Bonuses and increment, bonus for HP department is minimum 2 months basic pay, but if you take those 2 months Bonuses and divided by 12 months and you calculate that you work an extra hour every single day, is not even enough to say that that bonuses paid your extra one hour (OT) you worked for that year. Is less then 1.5 times of the OT rate. But considering that they wish you to work until 8 pm, the bonus is not really a bonus anymore if you see it this way, you can be paid more if a company actually pays for OT. They have a performance bonuses is separately paid from the 2 months minimum bonus, this performance bonus can reach up to 6 months pay,only special cases will get 6 month bonuses and this employee actually hit close to 200% or more than 200% of his annual target, the mean average is people achieving their target is around 80% to 100% plus, you will only given this bonus if only you hit more than 100% of your target. Increment is based on KPI and there is no transparency on the calculations of your increments, they always says is up to management to calculate the increment.",1,Sales and Marketing Executive (Hire Purchase Officer),Seremban,current,1,1,1,1,1,"Any kind of loans, you as a staff will get a lower interest rate",Bad work life balance and overall a bad experience,6,100,https://malaysia.indeed.com/cmp/Public-Bank-Berhad/reviews?start=100
11 January 2023,"Facing different people everyday,solve a lot of problem","A lot of works,busy every day. many many guidelines to follow,attend customer needs ,make customer happy ....... Also a lots of benefits working there Medical claim n bonus",4,CSR,Selangor,current,0,0,0,0,0,,,6,100,https://malaysia.indeed.com/cmp/Public-Bank-Berhad/reviews?start=100
3 January 2023,Depend on which branch and which division you are attached to,'-The working environment and culture depends on which branch you are attached to-The salary package and benefits is good -No work-life balance -Lots of paperworks and workloads -Good training base for fresh grads,3,Management trainee (credit),Sarawak,former,2,4,3,2,2,The salary package and benefits is good,'-No work-life balance -Lots of paperworks and workloads -Good training base for fresh grads,6,100,https://malaysia.indeed.com/cmp/Public-Bank-Berhad/reviews?start=100
15 December 2022,Productive,"Can get a lot of experiences there, learn all the banking regulations and law, is the best service in the banking industry, salary and benefits is good.",4,Customer Service Representative,Perak,current,4,4,4,4,4,Benefits,,6,100,https://malaysia.indeed.com/cmp/Public-Bank-Berhad/reviews?start=100
