review_date,review_title,review_body_text,overall_review_rating,job_title,location,employee_flag,rating_work_life_balance,rating_compensation_benefits,rating_job_security_advancement,rating_management,rating_culture_values,pros_text,cons_text,page_number,start_offset,source_url
30 October 2022,Good bonus but no work life,Promising bonus and work life balance all depended on your boss and colleague. Job security is high and career progression is good if your sales figures are good.,3,Senior Executive,Kuala Lumpur,current,2,4,4,3,3,Good bonus,No worklife balance,6,100,https://malaysia.indeed.com/cmp/Public-Bank-Berhad/reviews?start=100
25 October 2022,colleagues are helpful,"help to process loan applications, high volume of workload, somehow credit analyst need to do cross selling products, management and workplace culture need to be improve",3,CREDIT ANALYST,Kuala Lumpur,former,1,4,3,2,1,,,6,100,https://malaysia.indeed.com/cmp/Public-Bank-Berhad/reviews?start=100
15 October 2022,So so experience,Nothing much to learn from colleagues and repetitive work. Poor management and outdated equipment. Would not recommend if you are eager to learn something new.,3,Software Engineering Intern,Bandar Baru Bangi,former,0,0,0,0,0,,,6,100,https://malaysia.indeed.com/cmp/Public-Bank-Berhad/reviews?start=100
5 October 2022,Work culture depends on your division,"Pretty much depends on your boss working style. Certain bosses tend to micromanage, so you are likely to feel more stressed and have less freedom at workplace. Overall, the people here I have dealt with are generally quite nice.",3,Assistant Manager,Klang,current,3,4,4,3,3,"Staff loans, job security","Lack in basic infrastructure, hierarchy in workplace",6,100,https://malaysia.indeed.com/cmp/Public-Bank-Berhad/reviews?start=100
30 September 2022,Good pay and good benefit,"This is not the kind of work you should do if you actually wanted to have a work-life balance. Anyway, my colleagues have been quite helpful. Appreciate!",3,Senior Financial Executive,Sarawak,former,3,4,3,3,3,,,6,100,https://malaysia.indeed.com/cmp/Public-Bank-Berhad/reviews?start=100
3 September 2022,Ok to work here but lately staffs are treated very unfairly,"Was a haven to work in but now after retirement of previous bosses, new bosses not thinking of existing staffs career advancement but instead bringing in new staff",3,Assistant Manager,Kuala Lumpur,current,3,3,3,3,3,,Long working hours...they just want the job to be completed,6,100,https://malaysia.indeed.com/cmp/Public-Bank-Berhad/reviews?start=100
22 August 2022,High pay and great benefits but expect to work a lot,"Go to the office early in the morning and leaving late, the job is also quite repetitive. But the benefits and pay are really good, the year-end bonus is very generous.",4,Trainee,Penang,current,2,5,5,4,3,"Healthcare, employees benefits, pay, annual leave","long working hours, stressful job",6,100,https://malaysia.indeed.com/cmp/Public-Bank-Berhad/reviews?start=100
15 August 2022,Fast paced and very old school method,"You got to really have passion before joining in banking sector. If you really wanted a work life balance kind of work, then this is not for you. Overall for me, I learned alot and I have a really supportive colleagues which make my life much more easier to cope up with all the problems.",4,Management trainee,Ipoh,former,3,4,4,4,4,,,7,120,https://malaysia.indeed.com/cmp/Public-Bank-Berhad/reviews?start=120
13 August 2022,Good place to start working with good and friendly colleagues.,Pros - helpful staff and seniors - good bonus - medical benefit - staff loans Cons - work environment - no work life balance . Just work - long hours work - slow promotion,4,Assistant manager,Kuala Lumpur,former,1,4,4,3,1,,,7,120,https://malaysia.indeed.com/cmp/Public-Bank-Berhad/reviews?start=120
13 August 2022,Dull working environment,"working in branch as credit officer is the worst job position ever. you have to do tons of credit admin job, cross-selling, source for new loans, credit processing and more. not to mention, the sales staff in the bank (sales and marketing executive - sme) is the stupidest position ever, act like messenger and has minimal credit knowledge.",3,"Senior Executive, Credit Department",Selangor,former,2,4,3,3,2,"good bonus and increment, medical claim","no working balance, old style management",7,120,https://malaysia.indeed.com/cmp/Public-Bank-Berhad/reviews?start=120
2 August 2022,First Job,Great collogues there to help and assist you. Great environment. Normal working hours. Worklife balance was manageable. But the sales targets were high and stressful to achieve due to pandemic constrain.,4,Financial Executive,Shah Alam,former,5,3,3,4,1,,,7,120,https://malaysia.indeed.com/cmp/Public-Bank-Berhad/reviews?start=120
18 July 2022,Well rewarding if you are able to perform,Demanding sales and target based. You need to be ready to spend hours working with the bank. Good colleagues if you happen to be in a branch that wants to strive to perform. Old school kind of management.,4,Manager,Penang,current,3,4,4,3,3,,,7,120,https://malaysia.indeed.com/cmp/Public-Bank-Berhad/reviews?start=120
4 July 2022,Comfort and stable,"If you're looking for security, this is the company you should apply for. Good salary and good benefits. Stable and comfortable. you just need to do the same things everyday.",5,COMPLIANCE OFFICER,Kuala Lumpur,former,4,5,5,4,3,"Benefit, salary, colleagues",Work,7,120,https://malaysia.indeed.com/cmp/Public-Bank-Berhad/reviews?start=120
20 June 2022,Great place for retirement,"If you want a stable and slow paced working environment, you could come here. Super conservative and manual work. Also, I would say depends on your department culture. You might have to pretend to be busy and stay back just to show that you sre “busy” sometimes else they might think you are very free. Cina man mindset.",3,Senior executive,Kuala Lumpur,former,2,2,5,1,3,,,7,120,https://malaysia.indeed.com/cmp/Public-Bank-Berhad/reviews?start=120
13 June 2022,Fast-paced and stressful working environment,People are good but office/team culture is too traditional and not really open minded. No work-life balance. But the medical benefits or other staff benefits are quite good.,3,Management Trainee,Kuala Lumpur,former,2,4,4,2,1,Good Benefits,no work-life balance,7,120,https://malaysia.indeed.com/cmp/Public-Bank-Berhad/reviews?start=120
17 May 2022,Stressful,Nice salary but stressful environment. Need to do cross SL which make sit very difficult. But good bonus. 2 months bonus min. But target difficult to reach. Marketing method too aggressive,5,Management Trainee,Balakong,former,5,5,5,5,5,,,7,120,https://malaysia.indeed.com/cmp/Public-Bank-Berhad/reviews?start=120
7 May 2022,Heavy workload,Heavy workload Stress environment No work life balance But with good starting salary for fresh grad Good bonus basically is for your ot pay everyday,3,Frontline,Selangor,current,3,4,4,3,3,,,7,120,https://malaysia.indeed.com/cmp/Public-Bank-Berhad/reviews?start=120
26 April 2022,Really bad work culture. No work life balance. Good pay and bonus.,"Everyone is working long hours. Would be great if management frequently check on the employees' mental health. Good pay and bonus, annual leave allocation is also great.",4,IT,Malaysia,former,2,5,3,3,2,,,7,120,https://malaysia.indeed.com/cmp/Public-Bank-Berhad/reviews?start=120
14 April 2022,Company with good benefit,The working environment can be stressful and need to work overtime (Be prepared to work for long hours). Career progress for my specific department is kind of slow compared to other departments.,3,Senior Executive,Kuala Lumpur,former,2,5,4,3,3,,,7,120,https://malaysia.indeed.com/cmp/Public-Bank-Berhad/reviews?start=120
9 April 2022,fast paced - good advance,"a good place for anyone who need career advancement however workplace culture is not that good at all, fast paced & work life not balance high volume of tasks",3,Credit Analyst,johor,former,1,4,4,3,1,lots of leave,work life not balance,7,120,https://malaysia.indeed.com/cmp/Public-Bank-Berhad/reviews?start=120
8 April 2022,Stresssss,"Stresssssfulllll Environment fast pace no work life balance at all damm stressfull no OT management is old school, IT is slow, too many procedure and rule to follow",2,Credit Analyst,Kuala Lumpur,current,1,2,2,1,1,,,7,120,https://malaysia.indeed.com/cmp/Public-Bank-Berhad/reviews?start=120
7 April 2022,Multitasking,"Multitasking is a must working in PBB, especially based in Branch. We have to attend walk in customer, complete our daily task, picking up telephone calls at the same time. IT SYSTEM in PBB disappointing me because not every PC comes with Microsoft Office. Speaking of culture, it depends on Branches. Mine is quite OK, seniors are willing to teach.",3,Credit Analyst,Pandan Indah,former,3,4,4,2,2,,,7,120,https://malaysia.indeed.com/cmp/Public-Bank-Berhad/reviews?start=120
2 April 2022,Productive and fun workplace,"I’ve been working here for 18 months,to be honest,Public Bank staff benefit is very good,I can enjoy bonus once or twice in a year.Other than this,management also very supportive.",5,Senior Financial Executive,Puchong,current,5,5,5,5,5,Staff benefits is good,No,7,120,https://malaysia.indeed.com/cmp/Public-Bank-Berhad/reviews?start=120
1 April 2022,No work life balance,"Bonus is great among the banking industry. However, procedure of work may be very tedious. Long working hour, job will never be finished. Target will never achieve as management will further increase the target once you achieved it.",3,Credit Analyst,Kuala Lumpur,current,1,4,3,3,3,,,7,120,https://malaysia.indeed.com/cmp/Public-Bank-Berhad/reviews?start=120
26 March 2022,Ok,"Most good benefits among banks Have to work hard , multitask Must do sales, is all about target and figures Stressful, challenging, have to work smart",4,Executive,Kuala Lumpur,current,3,5,4,3,2,,,7,120,https://malaysia.indeed.com/cmp/Public-Bank-Berhad/reviews?start=120
16 March 2022,stable job,"Worked as a UT sales consultant in a branch. Basically, you're not going to survive and make money if you're placed into a small branch/not so crowded area. Commission structure changes every year.",2,Senior Financial executive,Kuala Lumpur,former,3,3,3,1,5,,,7,120,https://malaysia.indeed.com/cmp/Public-Bank-Berhad/reviews?start=120
5 March 2022,Productive,Best place go learn for work and to work . Everyone have chance can try to work here as the place learn many thins as you can untill other job going to you,4,Senior,Kedah,current,4,5,5,3,3,,,7,120,https://malaysia.indeed.com/cmp/Public-Bank-Berhad/reviews?start=120
18 February 2022,Very competitive environment,I was a junior executive and it’s been stressful and manager keep pushing for figure and no sense of belonging in the company. The salary is good if you can perform beyond and consistently,3,Financial executive,Damansara,former,2,3,1,2,1,,,8,140,https://malaysia.indeed.com/cmp/Public-Bank-Berhad/reviews?start=140
13 February 2022,Fast pace and stressful environment,"Stressful environment . Competitive environment Never work life balance Micromanagement Great benefit , but toxic working culture.",3,Sales and marketing excecutive,Penang Island,former,2,4,2,3,2,Good benefit,No work life balance,8,140,https://malaysia.indeed.com/cmp/Public-Bank-Berhad/reviews?start=140
28 December 2021,Good,Friendly manager especially the sales manager of Sabah Region. He is very supportive and will make you feel comfortable. Friendly colleagues. Good salary,3,Finance Intern,Kota Kinabalu,current,4,5,5,5,3,"salary, benefits",workloads are heavy,8,140,https://malaysia.indeed.com/cmp/Public-Bank-Berhad/reviews?start=140
10 November 2020,Efficient,Need to Work fast and accurate Service above all Customer always right Lots of Training provided Rules and regulations to be adhered to Excellent working environments,4,Officer,Jalan Munshi Abdullah,former,4,5,4,4,4,Pay accordingly,Demanding,8,140,https://malaysia.indeed.com/cmp/Public-Bank-Berhad/reviews?start=140
15 October 2020,Fast paced working environment,"It is a nice place to work with different cultures, very stressful environment at the same time it is fun. Good benefit and public bank berhad have never fail to pay the staff's bonus and exgratia. One of the best place i ever worked with.",5,Admin Executive,Permas Jaya,former,1,5,5,3,5,"Annual Dinner, Monthly birthday celebrations",Stressful working environment,8,140,https://malaysia.indeed.com/cmp/Public-Bank-Berhad/reviews?start=140
12 August 2020,Good,"Good to work in the bank. Teamwork among colleagues. Got paid for overtime when working on weekend. Benefits, good. Quite stressful. Good and caring bos",4,Senior Processing Officer,Taman Maluri,former,2,4,4,4,4,Good benefit,No work life balance,8,140,https://malaysia.indeed.com/cmp/Public-Bank-Berhad/reviews?start=140
7 August 2020,Everything Good,"While i join PBB which is Top bank in Malaysia. Great benefit. The training also very professional, willing give the best to staff. Work in public bank also can connect with lots of customers.",4,Assistant Sales Manager,Sibu,former,4,5,4,4,4,,,8,140,https://malaysia.indeed.com/cmp/Public-Bank-Berhad/reviews?start=140
4 May 2020,Fun with group of people,'- Typical freelance time - Learned about sales and closed sale - the management good - Hardest part of the job was an objection from the client - most enjoyable was the commission,5,UTC,Sibu,former,4,5,4,5,4,,,8,140,https://malaysia.indeed.com/cmp/Public-Bank-Berhad/reviews?start=140
28 April 2020,Work life NOT balance,Public Bank is a good company providing lots of benefits to Staff. Training provided in KL and colleagues are friendly. Work life balance is not for sales staff.,4,Senior Finance Executive,Johor,former,3,4,4,4,3,employee benefits,no work life balance,8,140,https://malaysia.indeed.com/cmp/Public-Bank-Berhad/reviews?start=140
4 April 2020,Do a typical work as a frontliner,I do a operation work in frontline. Im ok with this workflow . My strength is i can work under presure and working under minimum supervise . My weakness is about marketing. Im not a person can convince customer about a product.,5,Executive,Gombak Kuala Lumpur,current,3,5,5,3,3,,,8,140,https://malaysia.indeed.com/cmp/Public-Bank-Berhad/reviews?start=140
27 March 2020,A lot of things can be learned in this Bank. Good management and collaborative woking environment.,The Best Bank in Malaysia. Management of the Bank is very good. Collaborative working environment. Personal effort will lead to new knowledges and experiences in the business line. The Bank also provide excellent learning programmes for their staffs. Benefits? You can't never imagined.,4,Clerk/Typist/Cashier,Kuantan,former,4,5,4,4,5,,,8,140,https://malaysia.indeed.com/cmp/Public-Bank-Berhad/reviews?start=140
13 March 2020,Productive,a good start for fresh graduate to know how is the culture of banking line and getting in knowledge of compliance. Every kind of work is tough thus learn from it.,3,Senior sales and marketing executive,Johor Bahru,former,0,0,0,0,0,,,8,140,https://malaysia.indeed.com/cmp/Public-Bank-Berhad/reviews?start=140
9 March 2020,Ppb is easy job as a clerk,A typical day at PPB is pretty relax I learned how to manage my money in my drawer and learned how to make transaction how to print the receipt and FD(fixed deposit) We have to print dayend to make sure we have the correct amount off money in our drawer The most hardest part of the job is when u are not balanced and u have to find what amount of money u low on and try to find who was the customer,5,Temporarily clerk,Taman molek,former,5,5,5,5,5,,,8,140,https://malaysia.indeed.com/cmp/Public-Bank-Berhad/reviews?start=140
4 February 2020,Great Teamwork,Amazing work place and team work. Training provided and fun training area. All the Colleagues are friendly and easy to adapt new environment. Offering a great help to new employees.,4,Financial Executive (Bancassurance),Sabah,former,3,4,4,3,2,,,8,140,https://malaysia.indeed.com/cmp/Public-Bank-Berhad/reviews?start=140
16 January 2020,Good,Stress and fast pace always brings improvement. After experienced working at other company hope could go back bank for next job. Appreciate I have experience in Public Bank.,5,Senior Executive - Credit Control,Klang,former,5,5,5,4,4,,,8,140,https://malaysia.indeed.com/cmp/Public-Bank-Berhad/reviews?start=140
4 January 2020,Workplace,"Good stepping stone for graduates. Tip top benefits among all banks. Expect to work for long hours. Recognition comes not from hours of working. bright site: convenient to commute to working place, amazing colleagues.",3,Assistant Manager,KL,current,2,4,4,3,2,,,8,140,https://malaysia.indeed.com/cmp/Public-Bank-Berhad/reviews?start=140
22 December 2019,Overall culture is to work as much as you can but Overtime is not claimable,Compensation and benefit is good Environment always is in fast pace and competitive. Even within same organisation. Competitive between other branches in same organisation in the same area,3,Management Trainee / Junior Executive,Penang Island,former,1,3,2,2,1,,,8,140,https://malaysia.indeed.com/cmp/Public-Bank-Berhad/reviews?start=140
4 December 2019,The best bank to work and great place,Enjoy every moment in the back and was an amazing journey of learning and sharing. I would recommend to anyone who is looking for a career in Banking. This bank delivers it,4,Assistant Manager System,MY,former,5,5,0,5,5,,,8,140,https://malaysia.indeed.com/cmp/Public-Bank-Berhad/reviews?start=140
22 November 2019,Stable chinaman company,Very stable company and great staff benefits. However there’s no work life balance. They expect you to stay back everyday and come back during weekends.,4,Credit Analyst,Penang,current,2,5,3,2,2,,,8,140,https://malaysia.indeed.com/cmp/Public-Bank-Berhad/reviews?start=140
15 November 2019,Productive Workplace,'- get to meet different types of customer everyday and attending their inquiry accordingly. - flexible management - learned to multitask - get to chance to attend training in Kuala Lumpur - sat for examination to obtain a license in order to sell and promote insurance products,4,Insurance Specialist,Kota Kinabalu,former,4,4,4,4,4,,,8,140,https://malaysia.indeed.com/cmp/Public-Bank-Berhad/reviews?start=140
9 November 2019,Having a good training center,Its a good place to work with but sometimes is might be stress when the boss keep on pushing you and do not have a good communication skills.The training center is good,3,Hire Purchase processing officer,Kuantan,former,4,4,3,2,2,,,9,160,https://malaysia.indeed.com/cmp/Public-Bank-Berhad/reviews?start=160
24 October 2019,Environment and Job security,Environment and cooperation with collegue are great.Sale department got target to achieve.Must and compulsory to achieve.Much courses and events.Done.,3,Senior Financial Exec,Pontian Kechil,former,2,4,2,2,3,,,9,160,https://malaysia.indeed.com/cmp/Public-Bank-Berhad/reviews?start=160
20 October 2019,No Life & Bad management,"expecially in hire purchase department , no life balance. All decide & review by manager level. Make things no fair at all.Management never concern about staff health & never consider on staff position.",2,Senior Executive,Sungai Petani Kedah Malaysia,current,1,4,4,2,2,,,9,160,https://malaysia.indeed.com/cmp/Public-Bank-Berhad/reviews?start=160
19 October 2019,Good working environment!!!,Colleagues are very good and willing to guide you. I enjoyed the people I worked with. It was a friendly and fun atmosphere. If you work hard you will be rewarded.,4,Assistant Manager,Jalan Ampang,former,3,4,4,3,3,,,9,160,https://malaysia.indeed.com/cmp/Public-Bank-Berhad/reviews?start=160
11 September 2019,Good,Working as a banker at loan department quite challenging. Nowadays you have to be as a multitasking staff. So you can covered up a different department.,4,Credit & Control Clerk,Shah Alam,former,3,5,4,3,4,,,9,160,https://malaysia.indeed.com/cmp/Public-Bank-Berhad/reviews?start=160
2 September 2019,good job security,"profitable bank, good benefit, provide a good learning platform, opportunities to grow & learn from senior management. good reputation among local as well as overseas individual.",5,Assistant Manager,Johor,current,4,5,5,5,4,,,9,160,https://malaysia.indeed.com/cmp/Public-Bank-Berhad/reviews?start=160
29 August 2019,Productive,A good place to learn with comprehensive training provided. Training program and e-learning to keep staffs' knowledge up-to-date. A prospective organization in Malaysia and would be eventually expend in other countries.,4,"Senior Executive, Credit Officer",Pahang,current,0,0,0,0,0,,,9,160,https://malaysia.indeed.com/cmp/Public-Bank-Berhad/reviews?start=160
22 August 2019,Productive and good workplace,"Gain new experience , learn how to make an attachment with customer and how to communicate with customer. Need to take insurance examination before start to sell the insurance and join the company.",4,Finance Executive (Insurance Specialist),Changlun,former,3,4,4,4,4,,,9,160,https://malaysia.indeed.com/cmp/Public-Bank-Berhad/reviews?start=160
18 August 2019,Ok,Need to improve the medical coverage as the medical coverage did not covers dependants of employee during probation period. The system of medical coverage also need to be improved.,3,"Senior Executive, Shariah Audit",Kuala Lumpur,former,4,2,3,3,3,,,9,160,https://malaysia.indeed.com/cmp/Public-Bank-Berhad/reviews?start=160
5 August 2019,"If you are in a sales role, Good Luck","The Public bank is a good bank to invest in their share, not invest your time in it. The organization is too big, so it's hard to manage the corporate culture. If you work in a branch, sometimes the branch manager also can't even remember your name.",3,Senior Share Investment Exe.,Johor Bahru,former,3,2,2,1,1,,,9,160,https://malaysia.indeed.com/cmp/Public-Bank-Berhad/reviews?start=160
8 July 2019,Good workplace,A lot of friendly staffs from various background working together,4,Sales and Marketing Executive,Klang,former,0,0,0,0,0,Great benefits,Long hours,9,160,https://malaysia.indeed.com/cmp/Public-Bank-Berhad/reviews?start=160
9 June 2019,Good working environment,The company has a good working environment which involve in good colleagues and comfortable working space. The company concerned on employees' advantages which the main office provide in-house gym room.,3,SENIOR MERCHANT SALES EXECUTIVE,Kuala Lumpur,current,3,3,3,3,3,,,9,160,https://malaysia.indeed.com/cmp/Public-Bank-Berhad/reviews?start=160
3 June 2019,Good company overall,The salary/benefits make up for the poor work-life balance. Promotions are highly performance based which is good. Performance bonuses are attractive as well.,4,Assistant Manager (A4),Kuala Lumpur,current,3,5,5,4,3,,,9,160,https://malaysia.indeed.com/cmp/Public-Bank-Berhad/reviews?start=160
16 May 2019,Productive and fun place to work,Daily routine handling customer through inbound and outbound call.I learnt how to handle customer and how the banking system. Management very supportive and give advice to increase my productivity,4,Customer Service officer,Kuala Lumpur,former,4,5,4,3,4,,,9,160,https://malaysia.indeed.com/cmp/Public-Bank-Berhad/reviews?start=160
13 May 2019,Highly stressful but highly rewarding,"Top quality work is expected and if perform well, will be recognised with good pay/bonuses. Staff benefits are very good especially medical benefits. May lack work-life balance during peak periods.",5,Assistant Manager,Kuala Lumpur,former,3,5,5,4,3,,,9,160,https://malaysia.indeed.com/cmp/Public-Bank-Berhad/reviews?start=160
7 May 2019,Everyone is busy working,"working culture here is encouraging employee to work hard and work overtime instead of work life balance. There are many things you could learn here like how to deal with senior and manager, complicated working relationship.",4,Senior Customer Service Officer,Kuala Lumpur,former,3,4,4,2,3,Good Pay,Work Overtime without pay,9,160,https://malaysia.indeed.com/cmp/Public-Bank-Berhad/reviews?start=160
17 April 2019,Good working environment,Good working environment but lack of family time as too much work to do takes our family bonding time. At time have to stay back to complete the jobs. Lack of time issues with family.,3,Assistant Manager,Bangi,current,2,3,3,2,2,,,9,160,https://malaysia.indeed.com/cmp/Public-Bank-Berhad/reviews?start=160
17 March 2019,One of the Best Company in Malaysia,Overall a very good company for career advancement and to stay for a long term as the position very secured and got many helpful senior and training for a fresh graduates.,5,Senior Financial Executive,Johor,former,4,4,4,4,4,"Training, Salary, Work Environment",,9,160,https://malaysia.indeed.com/cmp/Public-Bank-Berhad/reviews?start=160
13 March 2019,Its happinest,Good salary and benefit Good environment Multi tasks A lots i can learn. Systematic 5 working days. 2 mths bonus maintain Good friends. Provide courses,4,BANK EXECUTIVE,Tampoi branch,former,3,2,2,1,2,,,9,160,https://malaysia.indeed.com/cmp/Public-Bank-Berhad/reviews?start=160
16 February 2019,Good for current management,Good for management trainee. lots to learn. sometimes long hour. ...multi task job. Stress but manageable. Monday to friday job.Job benefit is okay. have to quit cuz i am moving to another country,3,Senior Executive,Sabah,former,0,0,0,0,0,,,9,160,https://malaysia.indeed.com/cmp/Public-Bank-Berhad/reviews?start=160
19 January 2019,Financial Executive,"Manage branch sales and financial products. Presenting and educate staff on bank's current updated products launch. Engaged with SME, Business Banking and Corporate customer to build more business.",5,Senior Corporate Financial Executive ( Basic Pay,Kuala Lumpur,former,5,5,5,5,5,working hour is peak,Very good place to learn and experience.,10,180,https://malaysia.indeed.com/cmp/Public-Bank-Berhad/reviews?start=180
