review_date,review_title,review_body_text,overall_review_rating,job_title,location,employee_flag,rating_work_life_balance,rating_compensation_benefits,rating_job_security_advancement,rating_management,rating_culture_values,pros_text,cons_text,page_number,start_offset,source_url
28 May 2023,It was great working at the company,"Mostly i enjoyed working in the company with great people. I love the position as a spend management executive. However, the salary for the job specification and skills was insufficient",3,Spend Management Executive,Kuala Lumpur,former,2,2,2,4,4,"remotely hybrid, supportive people",law salary,4,60,https://malaysia.indeed.com/cmp/Rhb-Bank-Berhad/reviews?start=60
7 May 2023,Very bad culture,Very bad culture and lots of politic among team members and also management level. Refrain from joining risk division. Require to polish shoes in order to get promotion.,1,Specialist,Kuala Lumpur,current,0,0,0,0,0,,,4,60,https://malaysia.indeed.com/cmp/Rhb-Bank-Berhad/reviews?start=60
7 May 2023,Fun workplace,Good working environtment. Friendly colleagues. Willing to help. Team work is excellent. Boss is willing to guide and help when necessary. Really enjoy working here.,4,Customer service,Kuching,former,0,0,0,0,0,,,4,60,https://malaysia.indeed.com/cmp/Rhb-Bank-Berhad/reviews?start=60
17 March 2023,Matured culture,"Matured culture where is it result based. Can take leave easily, no questions asked. Nobody disturb after working hours except scheduled deployment event. Healthy team who helped each others ' growth. Lots of makan2. Pretty pantry with facilities. Gyms. Clinics. Unlimited medical benefits.",5,Back end developer,Kuala Lumpur,current,0,0,0,0,0,,,4,60,https://malaysia.indeed.com/cmp/Rhb-Bank-Berhad/reviews?start=60
27 February 2023,Stressful working environment,"The worst place to work, selfish surroundings, unfair evaluation, meeting during lunch time, reporting till late night, on call 7days per week. Communication breakdown between regional sales head and subordinate.",1,Manager,Klang Valley,former,1,1,1,1,1,Incentive,Force to pass Target and meeting morning at places more than >50km,4,60,https://malaysia.indeed.com/cmp/Rhb-Bank-Berhad/reviews?start=60
15 February 2023,Productive and competitive surrounding,"I am so gladful that i have been able working in here as i received so much benefits and possesed so many useful skills, as well as maintaining patience during solving cases. Working here also taught me to be self-reliant and critical thinking while assisting customers on field. Plus, i had a good leader who has been patiently guide me step by step, which inspired me not to give up easily.",5,Customer Service Agent,Petaling Jaya,former,5,5,5,4,5,Annual leave,Not many option for food stalls,4,60,https://malaysia.indeed.com/cmp/Rhb-Bank-Berhad/reviews?start=60
9 January 2023,Hybrid working environment,Working with rhb is pretty exciting. Hybrid working environment. Have bonus even salary is a bit low compared to other banks in the market. Working in aml TM is a very fast paced. Need to meet daily target,3,AML tm,Petaling Jaya,former,4,3,3,2,3,Hybrid working environment.only 2 days in office the rest at home,A bit Stressful with the new management,4,60,https://malaysia.indeed.com/cmp/Rhb-Bank-Berhad/reviews?start=60
9 January 2023,Fun workplace,Great experience working here. Great colleagues and environment. Lots of workload but everyone were happy working there. All were helpful and friendly.,4,credit operations executive,Bangi,former,3,3,4,3,4,,,4,60,https://malaysia.indeed.com/cmp/Rhb-Bank-Berhad/reviews?start=60
20 November 2022,"High workload, Toxic workplace, low work life balance","Working as part of their sales executive and i gonna said it such a high pressure, toxic workplace to work at. They don't even provide me with a my own workplace as i had to share it with everyone else. The team in here are such a toxic workmates as they all gossiping and being loud and rude to each other. I wish they make a better change on the management part to be more work friendly place.",3,Sales Consultant PF,Ipoh,current,0,0,0,0,0,,,4,60,https://malaysia.indeed.com/cmp/Rhb-Bank-Berhad/reviews?start=60
11 November 2022,nil,all well good nice experience working experience good...famiky environment..but living in klang valley the paid will be not enough due to cost living.....,4,executive audit & compliance,Kuala Lumpur,former,4,4,4,3,4,nil,nil,4,60,https://malaysia.indeed.com/cmp/Rhb-Bank-Berhad/reviews?start=60
26 October 2022,Excellent Job Environment.,"Productive Industry, i love it. Best management and best staffs. Hope can get best position again such as Branch Manager or Area Manager. I've submitted my cv for the management to view... After left RHB , now my education qualification is Ex Master in Business Administration.",5,PERSONAL BANKER,Hutan Melintang Perak,former,5,5,5,5,5,,,4,60,https://malaysia.indeed.com/cmp/Rhb-Bank-Berhad/reviews?start=60
14 October 2022,Best Workplace Ever,Doing Sale with RHB Bank is the best moment that i ever have because at RHB Bank i can make a lot of money. Have a good teamwork and good leader to guide me as a junior staff.,5,Sales Executive,Kuala Lumpur,former,5,5,5,5,5,,,4,60,https://malaysia.indeed.com/cmp/Rhb-Bank-Berhad/reviews?start=60
5 September 2022,"if you can work under pressure, you can work here",Very little opportunity for growth. Good incentives. Low work life balance. Work under pressure to achieve monthly target. Friendly colleague. Low salary compared to other companies.,4,Collection Officer,Kuala Lumpur,former,3,2,2,3,3,Nice working area,Pressure to achieve target,4,60,https://malaysia.indeed.com/cmp/Rhb-Bank-Berhad/reviews?start=60
8 August 2022,Good workplace to start as a freshie.,"Really good experience. Must be active & fast learner to be there. As csa, you need to figure it out the solutions for the problems but dont worry, the staffs were friendly & very helpful. Medium range for the pay.",4,Customer Service,Petaling,former,4,3,4,4,5,,,4,60,https://malaysia.indeed.com/cmp/Rhb-Bank-Berhad/reviews?start=60
20 July 2022,No words,Simply very torturing TL. Always torturing to do other team's work. But never paid extra to the extra work we do for that other team . Never get relaxed break.,1,Inbound Officer,Kuala Lumpur,former,1,1,1,1,1,Ntg,Everything,4,60,https://malaysia.indeed.com/cmp/Rhb-Bank-Berhad/reviews?start=60
16 June 2022,"Low life balance, Low compensation","High workload, low compensation. Low in term of staff appreciation. Unsystematic management. High stress. Improper training. Low increment & bonus. Need to be more independent to learn",3,Customer service agent,Petaling Jaya,former,1,3,3,2,3,Office next to LRT,"low salary, low increment",4,60,https://malaysia.indeed.com/cmp/Rhb-Bank-Berhad/reviews?start=60
12 June 2022,competetive and fast phase,its a good place to work. management is okay. the learning curve is steep and challenging at times. environment is okay but it depends on the department you work for.,5,analyst,Kuala Lumpur,former,3,5,3,3,3,,,4,60,https://malaysia.indeed.com/cmp/Rhb-Bank-Berhad/reviews?start=60
12 June 2022,Fun Workplace,The team members are professional at work but collaborative when needed. The hardest part is where the branch does not being cooperative enough for some of the matters arises,4,Customer Care Center (Officer),Kuching,former,3,3,4,3,4,,Call volume to staff ratio is not balance,5,80,https://malaysia.indeed.com/cmp/Rhb-Bank-Berhad/reviews?start=80
10 June 2022,A lot of monthly business presentations,"I left the bank because my responsibilities entailed a lot of travelling to branches. My main responsibility was to ensure each branch met the desired business targets as required . If budgeted business was not achieved, I would be queried, being the Head of the entire region.",5,Vice President,Sarawak,former,4,4,4,5,4,,,5,80,https://malaysia.indeed.com/cmp/Rhb-Bank-Berhad/reviews?start=80
24 May 2022,Competitive & sales driven focus,"Good working environment with colleagues. Team focus more on sales, as there was a target that need to be achieved. When one haven't achieved yet, team will help others to achieve the sales target.",5,Sales Executive,Penang,former,5,5,5,5,5,,,5,80,https://malaysia.indeed.com/cmp/Rhb-Bank-Berhad/reviews?start=80
16 May 2022,productive and very supportive colleagues!,I enjoy working here as it has work life balance and good benefits.i love it all but only the salary.i think i am not being paid enough.The trainings given are good and the facilities provided are good,5,AML Compliance,Kuala Lumpur,current,5,4,5,5,5,"good colleague and bosses, benefits, career growth",salary,5,80,https://malaysia.indeed.com/cmp/Rhb-Bank-Berhad/reviews?start=80
26 April 2022,People are friendly.,People are friendly. Boss is nice. There is career advancement opportunities. Perhaps management can improve on work life balance and compensation..,5,Relationship manager,Kuala Lumpur,current,2,4,5,5,3,,,5,80,https://malaysia.indeed.com/cmp/Rhb-Bank-Berhad/reviews?start=80
20 April 2022,Talk About Sales Only,"Target oriented job. Everyday talk about sales. A very stressful job. Manager off during weekends but you have to go work at branch, outlet or at roadshow. Almost everytime your work expense claim are rejected by your superior. You loss more than you gain at this company.",2,Sales Executive,Klang,former,1,1,1,1,1,,,5,80,https://malaysia.indeed.com/cmp/Rhb-Bank-Berhad/reviews?start=80
9 April 2022,High turnover people come and go,Back office perspective Toxic environment Abundant workload The pay is low not worth it for entry level. .,3,Treasury,Tun Razak Exchange,current,1,2,1,4,1,,Short breaks. Boss expect you are a robot.,5,80,https://malaysia.indeed.com/cmp/Rhb-Bank-Berhad/reviews?start=80
7 April 2022,Fast-paced workplace that emphasize collaboration between coworkers,"Not much to say since I was there not for a long time but overall it was pretty nice. For a contractor like me, there are no bonuses or perks so I don't know much about it. Standard pros and cons working at a bank",4,Credit Operations Executive,Bangi,former,4,4,4,4,4,,,5,80,https://malaysia.indeed.com/cmp/Rhb-Bank-Berhad/reviews?start=80
7 March 2022,Not a good place at all,"A typical day at work getting threatened to finish a task that is impossible to finish. Management wants unrealistic and unachievable goals when they pay you low and not even pay overtime. Any ideas will not be taken seriously and management will just dismiss them. The salary range is also too low for a company boasting about being in the top 4 bank ranking list in Malaysia and its seemingly high profits. No matter how hard you work, and even if you get high KPI the annual bonus will not be based on the KPI, makes me wonder why is it even there on the first place.",1,xxxx,Kuala Lumpur,current,1,1,1,1,2,,,5,80,https://malaysia.indeed.com/cmp/Rhb-Bank-Berhad/reviews?start=80
23 February 2022,"Good team members, they will guide you.","Good team members, they will guide you. Free training and free lunch. Learning more about the new technologies. Politics and toxic, turnover rate is high.",3,Manager,Bangi,former,3,3,3,1,3,"Free lunch, training",Long working hours,5,80,https://malaysia.indeed.com/cmp/Rhb-Bank-Berhad/reviews?start=80
14 February 2022,Ok.,Very very hard to get promotion especually working in non sale job. Back office work usually is working long hours and even during weekend. Hard to get overtime.,3,IT Executive,Kuala Lumpur,current,3,2,3,2,2,Medical & loan benefits,No being well reward even when you have study hard.,5,80,https://malaysia.indeed.com/cmp/Rhb-Bank-Berhad/reviews?start=80
10 January 2022,Really enjoy collaboration with all the staff and vendors especially the business clients.,"Really honoured being service here's almost 5 years with great team great experience great journey towards my excellent future. Good facility such as gym, parking space, sports facility, clinic, hostels and so on.",5,IT Business Analyst• IT Project Management Office,Bangi,former,5,5,5,5,5,,,5,80,https://malaysia.indeed.com/cmp/Rhb-Bank-Berhad/reviews?start=80
30 December 2021,Not a good company to work at,Had to sacrifice my weekend and AL to attend to work related matters. Most importantly the pay is very low and bonus & increment is extremely low and doesn’t compensate our workload,1,Assistant manager,Kuala Lumpur,former,1,1,1,1,1,None at all,Low pay and too much workload,5,80,https://malaysia.indeed.com/cmp/Rhb-Bank-Berhad/reviews?start=80
28 December 2021,Bad management and leader,Otherwise okay. Stressful and need to work hard to achieve target. Nad approval rate as we need to achieve 650k every month. The good thing blacklist customer can do p/loan.,3,SALES CONSULTANT PF-i,Shah Alam,current,3,3,3,2,2,Good benefit,Lousy management and difficult to achieve as they decrease approval rate.,5,80,https://malaysia.indeed.com/cmp/Rhb-Bank-Berhad/reviews?start=80
12 December 2021,Fun & competitive,Supportive leaders and team makes the job even better. Salary paid fair enough with the job scope. But need to have extra miles since the crowd and market quite lesser compared to some other banks,4,Personal Banker,Pontian,former,4,4,4,3,3,Flexible,Depends on branch manager,5,80,https://malaysia.indeed.com/cmp/Rhb-Bank-Berhad/reviews?start=80
6 December 2021,best working environment,nothing to say as all are okay but a bit stress to achieve the target towards end of the month. the teamwork and colleagues are awesome and team leader are the best and very helpful,5,Tele-Collector,Kuala Lumpur,former,4,5,5,5,5,high target,,5,80,https://malaysia.indeed.com/cmp/Rhb-Bank-Berhad/reviews?start=80
22 November 2021,A better carrier growth and can learn other technologies,'- Unprofessional management not Supportive managers and team leads - Toxic culture - long working hours & weekends - Manual process - Lack of manpower,3,Anonymous,Bangi,former,3,3,3,1,1,Free breakfast after night activities,,5,80,https://malaysia.indeed.com/cmp/Rhb-Bank-Berhad/reviews?start=80
6 November 2021,Enjoy with workplace and helpful team,Not much to say.. but im happy working rhb team as their helpful cheerful and always work with no complaining. Love to work with rhb cmpany. under sales of coz target important but im not stressful coz branch always work under 1 team,5,Personal baner,Pasir Gudang,former,5,5,5,5,5,,,5,80,https://malaysia.indeed.com/cmp/Rhb-Bank-Berhad/reviews?start=80
2 November 2021,AML Analyst,"Good team lead who always there if you need help. However, they provide low salary. If they can provide higher. It will be better. Overall management is good",4,AML Analyst,Kuala Lumpur,current,4,3,3,3,5,Good colleagues,Low salary,5,80,https://malaysia.indeed.com/cmp/Rhb-Bank-Berhad/reviews?start=80
5 August 2021,Colleagues are very comfortable,"Thanks for your support and I'm glad worked there more 23years finally I took VSs....thank you so much, because of I'm survive and had decent family and life ..thank you again..",5,Teller/clerk,Seremban,former,5,5,5,5,5,Corporate is good,Senior staf are bias and very selfish on sharing knowledge.,5,80,https://malaysia.indeed.com/cmp/Rhb-Bank-Berhad/reviews?start=80
16 July 2021,Poor management from the first month join into the company. Lack of empathy shown by the manager,Not a good company because too much turnover. The management is too poor. Need to review the training program and how they hire the leader to guide the team. The leader always call staff at night,1,Executive,Klang Valley,former,2,1,1,1,1,No pros,"Poor management, bad leader",6,100,https://malaysia.indeed.com/cmp/Rhb-Bank-Berhad/reviews?start=100
12 January 2021,Stressful n hectic workplace,"no life, do not enjoy working, work stress, long working hours, difficult to get leave (leave conditions must meet the target), boss who is too strict without any mercy.",3,Personal Financing,Dataran Wangsa Melawati,former,1,1,2,1,3,,,6,100,https://malaysia.indeed.com/cmp/Rhb-Bank-Berhad/reviews?start=100
23 November 2020,"in overall, it's really stressful working in RHB as there's no work life balance at all. Have to work late at night and over the weekend","1) No work life balance 2) When any big issue happened, there must be someone to be blamed instead of to find the solution 3) Management seems don't want to understand the root cause of any issues 4) Lack of teamwork between the department 5) To seek cooperation from the other team and to get management's understanding on certain issues 6) if we get rewarded accordingly",2,Assistant Vice President,Kuala Lumpur,current,2,2,3,2,2,,,6,100,https://malaysia.indeed.com/cmp/Rhb-Bank-Berhad/reviews?start=100
11 November 2020,Productive and fun work place,I had fun working here. Got an experience. Also got benefit. The team was so Nice to each orhers. Thank you for give me this appotunities to work here.,5,Sales Executive,Kuala Lumpur,former,5,5,5,5,5,Adhock,Ok,6,100,https://malaysia.indeed.com/cmp/Rhb-Bank-Berhad/reviews?start=100
4 September 2020,status job,it not fair for pemanent status brobation 6 month not extend another 3 months. it should be must give changes for staff to prove the company that he can do if management extend another 3 month,4,sales consultant,Kuala Lumpur,former,4,2,4,1,3,,,6,100,https://malaysia.indeed.com/cmp/Rhb-Bank-Berhad/reviews?start=100
25 August 2020,really enjoy to work.,"i really enjoy working at there.i learning something new at there,all friendly staff,i regret so much because of my resign.i like mdm kavitha. she a really such us wonderful soul.",5,Teller,Kuala Lumpur,former,5,5,5,5,5,good,excellent,6,100,https://malaysia.indeed.com/cmp/Rhb-Bank-Berhad/reviews?start=100
18 August 2020,Good bank,Good local bank and very friendly and experience college . They are there to guide you . Bank having good benefit compare other company,4,Senior Database Admin,Selangor,current,0,0,0,0,0,,,6,100,https://malaysia.indeed.com/cmp/Rhb-Bank-Berhad/reviews?start=100
17 August 2020,Productive workplace,We have now adopted the Agile way of working which has proven to be effective. Teamwork has improved. Team members take ownership of their work and collaborate more effectively.,4,Head of Technical & Functional Learning,Kuala Lumpur,current,4,4,4,4,4,Casual dressing for those departments which have flipped to Agile,,6,100,https://malaysia.indeed.com/cmp/Rhb-Bank-Berhad/reviews?start=100
10 August 2020,work at easy Rhb,"Bad attitude of Sales manager, poor leadership skills leads to bullying and bad culture. It is a very stressful enviroment for staffs easy. I dont have the right to choose my own Mandate too and verbally request the junior staff to work on their only offday.",2,sales consultant,kipmart masai,former,1,1,1,1,1,salary,Bad attitude sales manager,6,100,https://malaysia.indeed.com/cmp/Rhb-Bank-Berhad/reviews?start=100
7 August 2020,Most regret to join in RHB,Everything are mess. Dun have proper department to teach new staff. During training also didnt follow the schedules. The course arranging is really horrible. I never expect the bank will provide this kind of lousy training.,2,Personal Banker (Executive),Sibu,former,2,2,2,2,2,,,6,100,https://malaysia.indeed.com/cmp/Rhb-Bank-Berhad/reviews?start=100
1 August 2020,Its fun working environment,Fun working environment. The work dealing customer quite stressful. Colleagues are helpful. Training on all the product should lengthen. Too many products to be covered within short time. Maybe product specialization could be better,4,CUSTOMER SERVICE,Kuala Lumpur,current,3,4,4,4,4,Good environment,Salary quite low,6,100,https://malaysia.indeed.com/cmp/Rhb-Bank-Berhad/reviews?start=100
14 July 2020,No work life balance,Work more than 8 hours No OT claim Forced to work till 9pm Salary will be calculated upto 6pm only Stressful environment Lunch break will be 1 hour Short break will be 15 minutes Basic + low commission given Most of the time work on weekends too to achieve target,2,Collection Officer,Capsquare Towet,former,1,2,2,1,1,Friendly unit head and team leader,Worst senior who doesn't help the new joinee,6,100,https://malaysia.indeed.com/cmp/Rhb-Bank-Berhad/reviews?start=100
21 February 2020,Environment/ management,Rhb is quite a good financial company bit sometime management may miss out the important things in daily basis which mean the facilities and also training for staff,5,Personal Banker,Kuching,current,5,5,5,3,3,,,6,100,https://malaysia.indeed.com/cmp/Rhb-Bank-Berhad/reviews?start=100
12 February 2020,high stress level but with positive challenges,'- flexible time - banking system - good management - less activity to contract staff - high target every month - learned about banking system and job,3,sales consultant,inanam,current,3,1,1,2,5,,,6,100,https://malaysia.indeed.com/cmp/Rhb-Bank-Berhad/reviews?start=100
7 January 2020,Great work place,Great work place full of colour and culture. Job specification is clear to be done. The management ia an open door practice. Provide fairness benefit between exec and clerk level.,5,CUSTOMER SERVICE EXECUTIVE,Johor Bahru,former,3,4,3,4,4,Good enviroment,,6,100,https://malaysia.indeed.com/cmp/Rhb-Bank-Berhad/reviews?start=100
6 January 2020,stress-full and unbalance work life,"it's a stressfull and unbalance worklife, noneffective management with slow action taking in solving problems. Management only focus with profitable area but less care about quality in every area especially in customer service area.",3,Clerk/Teller,Bintulu,former,1,3,1,1,1,,,6,100,https://malaysia.indeed.com/cmp/Rhb-Bank-Berhad/reviews?start=100
5 January 2020,good parking space,bonus given not to bad good colleagues sometimes work can be overwhelming due to staff shortage good culture overall some parts of building needs to be revamped,3,"Senior Executive, Self Service Banking",Kuala Lumpur,former,0,0,0,0,0,,,6,100,https://malaysia.indeed.com/cmp/Rhb-Bank-Berhad/reviews?start=100
14 December 2019,What i get at RHB bank,What i learn from this company is how to sell product and how to controll relationship between client. how to face problem then how i make solution. Rhb is one of the company With good management and it was amazing has work at this company.,5,Sale executive,Kota Tinggi,current,4,4,4,5,4,,,6,100,https://malaysia.indeed.com/cmp/Rhb-Bank-Berhad/reviews?start=100
4 December 2019,Nil,"Join in rhb banking group and you will know how you can work with your colleagues such as a leader, team leader, team partner in growth the business of rhb group",3,CLERICAL,Simpang Renggam,former,3,5,5,4,3,,,6,100,https://malaysia.indeed.com/cmp/Rhb-Bank-Berhad/reviews?start=100
26 November 2019,Good work,RHab is one good upcoming bank and provide lot opportunities to workers and carrier wise all staff can develop the skills of work. RHB also help staff by introduce good rate for personal loan to customer so it can help all the staff to achieve the sales Target permonth by slow and steady.,4,Sales executive,Pudu,former,4,5,4,4,4,,,6,100,https://malaysia.indeed.com/cmp/Rhb-Bank-Berhad/reviews?start=100
25 November 2019,Good culture,"I learned so many things about bank culture. i learned how to attract customer , to handle customer , and processing application customer when they apply for bank services. for me the teammates is so fun but a bit stress when you got the very fussy customer. so overrall for me this company so good.",5,Financial Advisor,Shah Alam,former,3,5,5,5,5,,,7,120,https://malaysia.indeed.com/cmp/Rhb-Bank-Berhad/reviews?start=120
20 November 2019,Work life balance/ engaging colleagues/ good workplace environment,"The most enjoyable part on this job is teamwork. All employees including manager will help each other to make sure all employees reach their target on a monthly basis. In addition, manager also give some encouraging words to make sure their staff always positive and work more harder without give up until all employees achieve the target.",5,EXECUTIVE,Selangor,current,5,5,5,5,5,,,7,120,https://malaysia.indeed.com/cmp/Rhb-Bank-Berhad/reviews?start=120
4 November 2019,was okay,"didnt take care of staff's benefits, over pressure staff, bias and unable to provide better training to those in need didnt provide the commission as promised. underpaid the staff.",2,Telesales Executive (TSE),Jalan Ampang,former,3,1,1,1,2,,,7,120,https://malaysia.indeed.com/cmp/Rhb-Bank-Berhad/reviews?start=120
16 October 2019,culture not good,salesperson get less benefits annual leave lesser compare to other bank medical benefit less culture quite difficult seniority always come first system. old,3,rm,Sarawak,former,4,3,2,2,2,,,7,120,https://malaysia.indeed.com/cmp/Rhb-Bank-Berhad/reviews?start=120
14 October 2019,comfort workpace,best teammate with best leader but mostly start with contract staff and not easy to be permanent staff. can gain more knowledge about financing and banking system,5,Inbound Officer,Kuala Lumpur,former,4,3,5,5,5,,,7,120,https://malaysia.indeed.com/cmp/Rhb-Bank-Berhad/reviews?start=120
8 October 2019,Best for people who want to gain experience in sales.,"The most enjoyable part on this job is teamwork. All employees including manager will help each other to make sure all employees reach their target on a monthly basis. In addition, manager also give some encouraging words to make sure their staff always positive and work more harder without give up until all employees achieve the target.",4,SALES CONSULTANT,Petaling,current,4,4,4,4,4,,,7,120,https://malaysia.indeed.com/cmp/Rhb-Bank-Berhad/reviews?start=120
7 October 2019,Not that good,"Because workplace is not flexible and the salary per hour not high. And currently all the work is very easy and no any difficult, and I would like to work with US employers.",3,Data Entry Specialist,Selangor,former,3,3,3,3,3,,,7,120,https://malaysia.indeed.com/cmp/Rhb-Bank-Berhad/reviews?start=120
