review_date,review_title,review_body_text,overall_review_rating,job_title,location,employee_flag,rating_work_life_balance,rating_compensation_benefits,rating_job_security_advancement,rating_management,rating_culture_values,pros_text,cons_text,page_number,start_offset,source_url
23 September 2019,Overall the team that I worked with provide unlimited support a d great learning experience in completing my task,Good learning experience and overall the team either within the Group or at Regional level provides the best supprt anyone can ask for; tremendous momentum to ensure the best effort are being done.,4,Senior Vice President,Kuala Lumpur,former,5,3,4,3,4,Good work and life balance;,,7,120,https://malaysia.indeed.com/cmp/Rhb-Bank-Berhad/reviews?start=120
16 September 2019,productive and positive workplace culture,'- positive environment - big organisation - communication with customer - different workplace culture - information benefit of product - the hardest part of the job is to convince the customer of benefit of product,5,TELESALES EXECUTIVE,Kuala Lumpur,current,5,5,5,5,5,,,7,120,https://malaysia.indeed.com/cmp/Rhb-Bank-Berhad/reviews?start=120
14 September 2019,I love this company untill i die...,The best experiences in my entire working experiences. The boss will be boss the staff are so cheerfull and full off plastic. I love LOVE LOVE LOVE X 100 MILLION love. Thank You so much RHB BANK BHD. .... Tq tq tq,5,Personal Banker and operation,Subang Jaya and Shah Alam 16,former,5,0,5,5,5,,,7,120,https://malaysia.indeed.com/cmp/Rhb-Bank-Berhad/reviews?start=120
31 August 2019,Really appreciate,Really appreciate get great experience.lovely environment.Friendly colleagues.if get opportunity will appreciate a show more of talent. wonderful job culture and flexible working hours.No stress and earning as we like,5,Assistant Manager/Sales Associate,Puchong,current,5,5,5,5,5,,,7,120,https://malaysia.indeed.com/cmp/Rhb-Bank-Berhad/reviews?start=120
22 July 2019,Had a great time by exploring myself to a new environment,Able to communicate with freedom.moreover get to learn and done a task individually and super fast.The platform gave a great experience to feel the work place dilemma and the way to solve the consequences with confident.,5,Consumer product and collection recovery departmen,"Cap square Tower,Kuala Lumpur",former,4,4,4,3,3,,Short break about 15 minutes after 5pm,7,120,https://malaysia.indeed.com/cmp/Rhb-Bank-Berhad/reviews?start=120
12 July 2019,High performance team,High performance team Fairly rewarded Great team members Work life balance Close relationship with superior Good remuneration package Great location Great facilities for staff,4,Senior Manager,Kuala Lumpur,former,4,0,0,0,0,,,7,120,https://malaysia.indeed.com/cmp/Rhb-Bank-Berhad/reviews?start=120
3 July 2019,Productive and have good balance working time,"Very nice happy working area with good benefits in too many ways such as staff welfare, health care, get lowest interest loan. Besides, the surrounding more calm as its located at sub area.",5,CREDIT OPERATION EXECUTIVE,Selangor,current,5,5,5,5,5,Good benefit for staff,Promotions,7,120,https://malaysia.indeed.com/cmp/Rhb-Bank-Berhad/reviews?start=120
26 June 2019,Good HR,very good handling staff need and wants. very patient with staff complaints and need good remuneration great and conducive workplace enjoyable environment,5,customer service officer,kuching sarawak,former,5,5,5,5,5,,,7,120,https://malaysia.indeed.com/cmp/Rhb-Bank-Berhad/reviews?start=120
20 June 2019,Productive,Work culture & environment is so friendly and different from other banks. The career path is good if you perform in the task given. Salary will be given based on your experienced.,4,PERSONAL BANKER,Johor Bahru,current,4,4,4,4,4,,,7,120,https://malaysia.indeed.com/cmp/Rhb-Bank-Berhad/reviews?start=120
12 May 2019,Had a good experience of working in banking line,Working in banking line was no easy but I learned a lot for it .. and I have achieve my targets most of the month and it was really a great experience And I have a good team leader to Guide me and my progress was shows very good,4,Tele-collector,Kuala Lumpur,former,5,4,4,3,5,Very lunch and free movie,Healthcare,7,120,https://malaysia.indeed.com/cmp/Rhb-Bank-Berhad/reviews?start=120
12 May 2019,Expand and Growing fast bank -RHB,We are the 1st bank using workplace like FB apps. My 1st experience seeing a lot people sharing work information instantly and you will get the latest info instant and fast from all different department. I was enjoy been select as talent management member to be learn guide lead and grown my career in RHB.,4,"Sales Manager,PF",PUCHONG,current,3,3,3,3,4,A lot reward voucher to be rewarded,,7,120,https://malaysia.indeed.com/cmp/Rhb-Bank-Berhad/reviews?start=120
7 May 2019,Good and fun environment to work,"Good leader, supportive colleague, good package and above all good staff engagement. nothing much to talk, still so new after graduation, and good learning environment",4,Operations Executive,KLCC,former,0,0,0,0,0,,,7,120,https://malaysia.indeed.com/cmp/Rhb-Bank-Berhad/reviews?start=120
26 April 2019,Fun,Good company to work with. Helpful manager and cheerful team members. Have a good life experiebce on how to handle our own personal financial plans. Good place to work in,5,Telesales Executive,Kuala Lumpur,current,4,4,3,4,4,,,7,120,https://malaysia.indeed.com/cmp/Rhb-Bank-Berhad/reviews?start=120
31 March 2019,Nice working environment,The management takes care of their employees very well. Bosses are down to all employees and employees can walk in to their bosses at anytime to discuss on the work matter or even personal issues.,5,Senior Brands & Regulatory Control,Malaysia,current,4,4,4,4,4,Nice working environment,Difficult to get promoted,8,140,https://malaysia.indeed.com/cmp/Rhb-Bank-Berhad/reviews?start=140
28 March 2019,Ok.,"Working at bank is good with their benefits, but the cooperation within each staff is worst. Teamwork is only for sometimes. Always need to be reminded.",4,Personal Banker Wealth,Kuching,current,3,5,5,3,4,Good benefit.,Competition with each others.,8,140,https://malaysia.indeed.com/cmp/Rhb-Bank-Berhad/reviews?start=140
27 March 2019,Productive and fun,It's 5 days work with rotating shift. Lots of staff but less working equipment. The hardest job is to convince customers and meet their satisfaction. Some customers are gems of person but there are few arrogant but its fun to deal with each of them. Every single day is a new and fresh day and those happened the day before shouldn't be brought today. That's how we work.,5,Customer service executive,Kuala Lumpur,former,4,4,5,4,3,Good salary and staff,Not being fair and bias,8,140,https://malaysia.indeed.com/cmp/Rhb-Bank-Berhad/reviews?start=140
24 March 2019,"Challenging, experience on dealing with customer",Knows how to tackle the situation based on the training given. Be familiar with bank products and services Need to be extra careful to handle difficult customer.,4,Customer Service Assistant,Kuala Lumpur,former,3,4,3,3,4,,,8,140,https://malaysia.indeed.com/cmp/Rhb-Bank-Berhad/reviews?start=140
7 March 2019,used to be a great company,There is much focus and emphasis on making sure staff succeed in the company.Responsible for so much work.overtime not allowed but employer wanna job to be done,3,SALES EXECUTIVE,Kuala Lumpur,former,3,3,3,3,3,flexible,distance from home,8,140,https://malaysia.indeed.com/cmp/Rhb-Bank-Berhad/reviews?start=140
1 March 2019,Good,Learning about contact centre environement. Understand the principle behind contact centre in banking industry. Overall working experience is good. Really enjoyed,5,Customer Service Executive,Kuala Lumpur,former,5,5,5,5,5,,,8,140,https://malaysia.indeed.com/cmp/Rhb-Bank-Berhad/reviews?start=140
27 February 2019,Cheerful workplace,"RHB Bank Berhad for me is a place giving me a lot of experience about how to handle customer. Position as a Sales Consultant taught me to improve my communication skills, give a good service before and after sales and how to attract customer. Its all about how you handle customer. Workplace culture is so enjoyable, all the staff very friendly and help each others. The hardest part of the job is when you are struggle to find customer and attract customer to trust you and product.",4,Sales Consultant ASB,"Ketereh, Kota Bharu Kelantan",former,3,4,4,3,4,,Stress,8,140,https://malaysia.indeed.com/cmp/Rhb-Bank-Berhad/reviews?start=140
22 February 2019,Productive and up to date,"Working the the bank industry forcing as the banker to always up to date with the current nation economy. Despite the economy progression were slow at the time, everything was in good hand since it is monitor under the Bank Negara and Ministry of finance. Work routine, have to meet up with client especially with the company entities. Along the way I've learned the structure of the financial industry in general and depth. As for the management are well structure and organize, thus it also allow the worker to learn new thing. As for the most enjoyable part of the job is that I was able to build a networking with other.",4,Associate Business Development Manager (ABDM),Kuala Lumpur,former,3,5,4,4,4,There are classes to equipt ourselves with finance knowledge.,Rejection by the potential customer.,8,140,https://malaysia.indeed.com/cmp/Rhb-Bank-Berhad/reviews?start=140
7 February 2019,Good place to work,"Good place to work and learn about financing, accounting and great place to develop your skills. The environment is good. They have a very good learning center that provided to new and current working to be better and more prepare",4,Business Development Manager,RHB PJ NEW TOWN,current,4,4,3,3,5,,,8,140,https://malaysia.indeed.com/cmp/Rhb-Bank-Berhad/reviews?start=140
2 February 2019,management in general,Good place to work. Typical bank industry environment. To complete volume and SLA at tight dateline. Need to work fast and at long hours. Able to learn new products.,3,senior executive,bangi selangor,current,3,3,3,3,3,,,8,140,https://malaysia.indeed.com/cmp/Rhb-Bank-Berhad/reviews?start=140
19 January 2019,Enermous surau & great cafe,Enormous surau & great cafe. Variety of choices from mamak to malay to chinese to western. I love the environment there. A clinic is on ground floor only.,4,Customer Service Representative,Kuala Lumpur,former,3,4,4,4,4,,HQ located at Jalan Tun Razak. Bad traffic during peak hour.,8,140,https://malaysia.indeed.com/cmp/Rhb-Bank-Berhad/reviews?start=140
8 January 2019,A fast paced working environment,"'-challenging, fast paced and great learning opportunity especially for fresh graduate -great platform to learn and get the experience -helpful employees",5,Human Resource Intern,Kuala Lumpur,former,5,5,5,5,5,,,8,140,https://malaysia.indeed.com/cmp/Rhb-Bank-Berhad/reviews?start=140
6 January 2019,Banking Company & feel like home at company,"Working in RHB its very cool and friendly colleagues. I learn in RHB, banking domain knowledge, especially Corporate banking sector. In technical learned some new concepts and documentations. Management is very cool. Workplace culture fun and helping. No hardest in this job, If I donno will search in google or ask my colleagues. In business part refer docs and technical part search in google. Daily enjoying at my workplace.",5,Senior Software Engineer,"Bangi, Kuala Lumpur , Malaysia",current,5,5,5,5,5,,,8,140,https://malaysia.indeed.com/cmp/Rhb-Bank-Berhad/reviews?start=140
4 January 2019,Good environment,Good environment and too many opportunity to carrier growth. A new culture been applied Easy to park your car or motocycle Near to KLCC Easy to do work as officemate very friendly,4,Team manager,Kuala Lumpur,current,4,4,4,4,4,Medical,,8,140,https://malaysia.indeed.com/cmp/Rhb-Bank-Berhad/reviews?start=140
28 December 2018,Very good place to gain knowledge and experience,"provide outstanding service to RHB Bank customers by answering questions, handling complaints, and troubleshooting problems with our products and services. we may handle a high volume of inbound or outbound calls or both and should seek to create a positive experience for each caller. we will listen to clients to understand the reason for their call, address all questions or complaints, and provide an accurate and efficient response.",4,Customer Service Executive,Kuala Lumpur,current,4,3,4,3,3,Unlimited medical insurance,Basic salary still lower than the other local bank,8,140,https://malaysia.indeed.com/cmp/Rhb-Bank-Berhad/reviews?start=140
26 December 2018,Great experience,"Nice working environment & good benefit. Can get a better career & experience in RHB. In sales line of course have a different challenge but in RHB i’ve create a sweet memory with achievements travelling, get voucher, ein a campaign and so on.",4,Personal Banker,Bandar Baru Nilai,former,3,3,4,3,4,Nil,Nil,8,140,https://malaysia.indeed.com/cmp/Rhb-Bank-Berhad/reviews?start=140
24 December 2018,no life balance,'- working more than 12 hours without OT - Good place to earn knowledge on banking line - workplace is good - no life balance because need to work until 9 pm and more also on weekend.,3,Collection Executive (Mortgage),Kuala Lumpur,former,2,3,3,2,3,,,8,140,https://malaysia.indeed.com/cmp/Rhb-Bank-Berhad/reviews?start=140
15 October 2018,Good advancement for career and base for learning,RHB Bank is one of the leading bank for the employee who wish to start their career in financial sector. The Bank provide the staff a good platform in corporate world especially in financial discipline. The workplace culture is god and convenient. The hardest part of the job is when you have to settle all the urgent and important matters at once. The most enjoyable part of the job is that you are being appreciated and satisfied that all the job will be done in due process and also chance to learn from the other stakeholder or businesses.,4,"Associate, Industrial Relations",Kuala Lumpur,current,4,3,3,3,3,Good learning culture,N/a,8,140,https://malaysia.indeed.com/cmp/Rhb-Bank-Berhad/reviews?start=140
9 October 2018,Working environment is good,"RHB is a very good company in malaysia to work with colleagues, environment and hard working.Everybody mostly prefer to work such type of company.But it's bit far",3,MSBI (SSIS) Developer,Bangi,current,3,3,2,4,4,,,8,140,https://malaysia.indeed.com/cmp/Rhb-Bank-Berhad/reviews?start=140
23 September 2018,Productive and Fun Place to work,'- Challenging Job - Able to build a fresh network of customer base - Able to explore various business market - Teamwork is essential - the hardest part of the job is meet monthly minimum target,3,Outlet Assistant Manager,Tesco Tanjung Pinang,former,3,3,3,3,3,"Fun working environment, Sufficient break time","Stressful, Too many Products, High monthly Target",8,140,https://malaysia.indeed.com/cmp/Rhb-Bank-Berhad/reviews?start=140
21 September 2018,Never compromise integrity,"I gave my entire career working upwards from a graduate trainee till the Senior Vice President level. I was forced to accept a golden handshake not because i was incompetent to lead a strong Loan Recovery team, my unquestionable integrity didn't sit well with one vocal shareholder who also a board of director member. As Head of Recovery, our task to maximise recovery and recalcitrant borrowers we have to punish.. i punished one by winding them up which irked this director as i did it on his friend's company. The rest was history..",5,"Senior Vice President, Head of Loan Recovery",Kuala Lumpur,former,5,5,5,4,5,Respected by peers,Lost a top job,9,160,https://malaysia.indeed.com/cmp/Rhb-Bank-Berhad/reviews?start=160
4 September 2018,Workplace,Good place to work with and to learn new things which will be the stepping stone for career enhancement. Engagement with various stakeholder gave more exposure and knowledge sharing.,5,"Vice President (Head), Group Compliance Governance",Kuala Lumpur,current,4,4,4,4,4,,,9,160,https://malaysia.indeed.com/cmp/Rhb-Bank-Berhad/reviews?start=160
17 August 2018,Productive and fun workplace,"The office provide games such as dart, pool, PS4 and congkak to release tension. It also have mini gym like treadmill, & boxing sandbag. 1Malaysia's environment, we got Malay, Chinese, & India staffs mixed with foreign people from oversea.",5,Executive Assistant,Kuala Lumpur,current,4,4,5,4,4,Nice coffee,None,9,160,https://malaysia.indeed.com/cmp/Rhb-Bank-Berhad/reviews?start=160
31 July 2018,not a great place to work,learned how to talk with customer the hardest part of the job is facing management normal working rouutine not recommended for career but good for gaining experience,1,Collection Officer,Kuala Lumpur,former,1,2,2,1,1,work,management,9,160,https://malaysia.indeed.com/cmp/Rhb-Bank-Berhad/reviews?start=160
29 July 2018,Management,"i love the most how this company manage their staff and in term of how the benefit given to the staff like monthly meeting with RD, managers and staff from other branch",4,sales executives,Petaling Jaya New Town,former,2,4,5,5,4,training,monthly meeting,9,160,https://malaysia.indeed.com/cmp/Rhb-Bank-Berhad/reviews?start=160
25 July 2018,"handling multi-tasking works, independent, be a good player in approach walk in customer or potential customer whose come in to the braanch.","Need to focus on the daily operation on saling of banking's product, Debit card, general and life insurance, personal loans and asb loans. i also need to make sure to attend all customer with good manner and ensure all original documents need to give them back. I also need to make sure any information or supporting document from customer need to keep in file. Need to achieve monthly target and ensure all complaints from customer are resolved.",4,Sales Executive,"Putatan, Sabah",former,3,3,3,3,3,medical card,short break,9,160,https://malaysia.indeed.com/cmp/Rhb-Bank-Berhad/reviews?start=160
5 July 2018,The hardest part of the job,Is have to achieve the target given which very challenging every months . Also most off the time spend is on the office . You will gain a lot of knowledge during this work which very helpful in future .,3,COLLECTION EXECUTIVE,Kuala Lumpur,current,2,2,2,2,2,,No overtime claim,9,160,https://malaysia.indeed.com/cmp/Rhb-Bank-Berhad/reviews?start=160
4 July 2018,get more experience and a good working environment,"working in my rhb company gets more knowledge and knowledge, my colleagues are very helpful and help each other. There I was also trained to be a very important subject to disilplin and to maintain trust or to be more responsible in carrying out my duties.",4,COLLECTION OFFICER,"jln munshi abdullah ,kuala lumpur",former,4,2,5,4,3,,,9,160,https://malaysia.indeed.com/cmp/Rhb-Bank-Berhad/reviews?start=160
2 July 2018,Productive and target oriented,"Encourage to achieve targets set by management. Fun work environment, got variety of race, good relationship among staff, a lot of cultural events,birthday celebrations organised. Supportive management where always organise meetings with managers/team supervisors, teamwork in achieving target for high incentives and pay.",5,Sales Consultant,Petaling Jaya,former,5,4,4,4,4,big incentives offered,"working late night and weekend without OT and double pay, the whole incentives will be burn if no target achieve.",9,160,https://malaysia.indeed.com/cmp/Rhb-Bank-Berhad/reviews?start=160
21 June 2018,Scattered objectives,"An established organisation, have been around for a while. Too many long service employees that have difficulty in adopting changes. Too much unnecessary paperwork. Overwhelmed with volumes that takes away feeling of accomplishment.",3,"Head Talent, brand",Kuala Lumpur,former,2,3,3,3,2,"Easy accessed to cafe, surau & coffee outlets",Bad jam at certain time,9,160,https://malaysia.indeed.com/cmp/Rhb-Bank-Berhad/reviews?start=160
4 June 2018,every day meetup customer,"nice counter and attractive decoration. can see many customer walk in but sometime get not quality customer. giving good benefit to staff. Waiting customer visiting counter to sign up services. But if the monthly target not hit, we have to find more customer outside. And have to study a lot of product and services.",4,Assistant Manager of EasyRHB,Titiwangsa,former,3,4,4,4,4,easly to reach counter because near to public transport,Suddenly always have to attain meeting with management,9,160,https://malaysia.indeed.com/cmp/Rhb-Bank-Berhad/reviews?start=160
28 May 2018,good benefit and career grow,"first week and end of week can't take annual leave. stress target has to achieve to get incentives. if you not achieve, must stay back till night. if still not achieve tomorrow has to pass the previous figure. for me is was great environment , friend and work must have ability negotiations high level to achieve goal. I leave because want to gain more experience.",4,Collection and Recovery Executive,Kuala Lumpur,former,4,4,4,3,5,standard lunch hour,2 time short break until night,9,160,https://malaysia.indeed.com/cmp/Rhb-Bank-Berhad/reviews?start=160
24 May 2018,Productive & need to achieve target set by management,"Working in Mortgage Department requireS to do everything fast & accurate. One tiny mistake will cost a lot to bank, that why need to check & ensure everything is in order before approve the loan documentation before move to next step. Working as teamwork are important in my team, we can share idea, problems & try to solve together. Bonding between team mate are good so that we can reduce the level of stress when we faced high work loads. Management also give rewards such bonuses, promotion, meet & greet with subordinates which made the staffs feel motivated to work harder",4,Senior Executive,Selangor,former,3,3,4,4,3,"Flexible on lunch time, flexible on clock in & out, annual leave",High workloads,9,160,https://malaysia.indeed.com/cmp/Rhb-Bank-Berhad/reviews?start=160
20 May 2018,Fun workplace with a good team work,"RHB Bank Berhad is company where you can earn more with your hardwork. A good teamwork, workplace, and environment. When you achieve their target you can get award from RHB. Every year you have target to achieve and different award to win.",5,Telesales Executive,Kuala Lumpur,former,5,5,5,5,5,No,No,9,160,https://malaysia.indeed.com/cmp/Rhb-Bank-Berhad/reviews?start=160
19 May 2018,Good commission,"The working environment is good, however need to improve the managent issues. The management line is outdated and sometimes causing problem to sales staff.",3,Sales Consultant,Kemuning Utama,former,3,5,3,3,3,High commission,Less life balance,9,160,https://malaysia.indeed.com/cmp/Rhb-Bank-Berhad/reviews?start=160
17 May 2018,Work environment quite stressful,The work environment start with a happy mood but it then will quickly change to stressful when we start to do it our jobs because we have a target every hour how much account that we need to contact. I learned how to used Microsoft Excel and Microsoft words they also provide a system that used to check balance in customer account. I've also have been through some training and Test with RHB.,3,Telemarketing officer,Kuala Lumpur,former,2,2,2,3,4,Insensitive,"No health care, No MC or leave for contract staff",9,160,https://malaysia.indeed.com/cmp/Rhb-Bank-Berhad/reviews?start=160
11 May 2018,Productive and target oriented,"Courage me to achieve targets set by management. Fun work environment where a lot of cultural events,birthday celebrations organised by recreational club. Supportive management where always organise meetings with managers/team supervisors.",5,Collection Officer,Kuala Lumpur,former,5,5,5,5,5,,,9,160,https://malaysia.indeed.com/cmp/Rhb-Bank-Berhad/reviews?start=160
24 April 2018,This company is very good name. And working in this place very nice,For me working as to take for experince is very good. And i working here very happy. For fresh graduate i sugget to work this company to make your metality strong and learn to control stress and work very hard.,3,Collecter,Kuala Lumpur,former,2,2,2,1,4,,,9,160,https://malaysia.indeed.com/cmp/Rhb-Bank-Berhad/reviews?start=160
21 April 2018,Many Paper To do at bank after banking hours,"This issue we already told HQ, but they never change it. They always say need to paper less at your job, but everytime we want to paper less there is not gonna happen, Example Doing a FD placement to customer there already using 6 paper in that FD placement, 2 is the placement paper then GMPC then Product Disclosure Sheet already in 6 pages at FD, how we want to paper less, and that is many issue in the bank, that why I'm not continue work at bank already.",3,Teller,Kuala Lumpur,current,3,3,2,2,2,Na,Na,9,160,https://malaysia.indeed.com/cmp/Rhb-Bank-Berhad/reviews?start=160
