review_date,review_title,review_body_text,overall_review_rating,job_title,location,employee_flag,rating_work_life_balance,rating_compensation_benefits,rating_job_security_advancement,rating_management,rating_culture_values,pros_text,cons_text,page_number,start_offset,source_url
24 August 2017,Fun workplace with variety sport every week..,1.process loan customer and then follow up untill customer come to agreement sign. 2. Searching and scanning of market for target customer. 3.the hardest part every month must achieve a target 4.enjoyable job but not fun around with work culture that be because a worker always change time to by time.,4,Sale Advisor,Kuala Terengganu,former,5,5,4,4,3,Free work style d high incentives,Management slow,3,40,https://malaysia.indeed.com/cmp/Bank-Rakyat/reviews?start=40
8 August 2017,The workplace a fun and people have a good relationship.,I learned many things to be a sales person. Also learn how to do marketing and approach customers to interested with the bank's product. The hardest part is i need to approach customer to attract them with the product if not i did't get any case for that day. The most enjoyable part is our company once a week make a gathering for built up relationship among us.,5,Sales Executive,Nusajaya,current,5,3,5,4,5,Working place a fun,Short break,3,40,https://malaysia.indeed.com/cmp/Bank-Rakyat/reviews?start=40
11 July 2017,Fun Workplace with Friendly colleagues,It is good for your career as long as you have strong mental capacity against your customer and also surrounding. You will get more knowledge if you working at branch rather than HQ because you will be exposed and involved directly with customer.,4,"Micro Credit Officer, Collection Officer",Bandar Tun Razak,former,4,5,3,3,4,,,3,40,https://malaysia.indeed.com/cmp/Bank-Rakyat/reviews?start=40
8 July 2017,Professional and reasonable,"The management is very nice and hardworking, the training is good also, and the workers a did a good job. I learned a lot with the leadership. The most enjoyable part of the job is to work in a peaceful.",3,Junior Marketing Executive,Kelantan,former,2,3,2,3,2,Long rest time,Long hours,3,40,https://malaysia.indeed.com/cmp/Bank-Rakyat/reviews?start=40
15 June 2017,Have fun this job,Can work by team..can manage my self if anthing problem.hardwoking..fun with custmer and staf. Work time. The culture very good.can get more knowledge.,5,Sale marketing,Pasir Mas,former,5,5,5,5,5,Free launches,Healthcare,3,40,https://malaysia.indeed.com/cmp/Bank-Rakyat/reviews?start=40
7 May 2017,a great working place,fun working place with friendly and amazing staff that willing to guide an internship student like me. it is a very great experience for me as i able to learn a lot of new things that i can apply to my future job.,5,internship student,Kota Tinggi,former,5,5,5,5,5,every tuesday is a potluck day. lots of food,,3,40,https://malaysia.indeed.com/cmp/Bank-Rakyat/reviews?start=40
22 April 2017,Nice workplace with good colleagues,Workplace comfortable and organized.Colleagues always provide guidance and friendly. Every day will be held the briefly meeting to tell about what happened yesterday and communicate any important information to all employees,4,TRAINER,Taiping,former,4,4,4,4,4,,,3,40,https://malaysia.indeed.com/cmp/Bank-Rakyat/reviews?start=40
18 April 2017,Fun working environment,Normal situation when handling customer Patient and negotiation skill Quite unfair on certain aspects Very good culture they have Handling rude customer just via phone Teamwork strive for monthly target,5,Telecollector,Brickfield,former,4,2,2,3,3,Free breakfast once a month,Healthcare,3,40,https://malaysia.indeed.com/cmp/Bank-Rakyat/reviews?start=40
16 April 2017,flexible working hours,"flexible working hours, fun workplace, highly motivated with a supporting team and team leaders, improvised my communication skill and taking care about staff welfare.",4,SALES EXECUTIVE,Petaling Jaya,former,4,4,4,4,4,,,3,40,https://malaysia.indeed.com/cmp/Bank-Rakyat/reviews?start=40
22 March 2017,Very production and having fun,"I think this is place gives me a reason why i passed an internship with excellent result. I mean working there is so fun, friendly employee, not a depressed job and very healthy working environment.",5,Internship,Perak,former,5,5,5,5,5,Friendly employee,Unspacious workplace,4,60,https://malaysia.indeed.com/cmp/Bank-Rakyat/reviews?start=60
19 February 2017,An attractive environment in marketing,Daily work connected with various government organizations and the corporate sector to make the scope of work to be challenging in the negotiations and reach a decision. Fun thing is to get acquainted with various backgrounds from various organizations.,3,Sales Execitive of Merchant Acquisition,"Menara Bank Rakyat, Jalan Rakyat, KL",current,3,3,3,3,1,Medical and Outstation Claim,Difficult to apply loan,4,60,https://malaysia.indeed.com/cmp/Bank-Rakyat/reviews?start=60
12 February 2017,Supportive team member,Work on Bank rakyat is more fun and great because the top management and all the staff in bank rakyat is the suportive and its always give me the positive vibes for start my work.,5,PERSONAL LOAN ADVISER,Semporna,former,5,3,2,5,5,long break,low payment,4,60,https://malaysia.indeed.com/cmp/Bank-Rakyat/reviews?start=60
20 October 2016,Productive,Good organization that everyday active market the product. The hardest job was to find the market place and get new customer.,3,Br SMART,Kuching,current,3,4,4,4,4,,,4,60,https://malaysia.indeed.com/cmp/Bank-Rakyat/reviews?start=60
29 September 2016,Fun place but i looking for more experience and its sad my contract end early,"Nothing to comment , I learn new thing, able to work on field , able to polish my communication and marketing skills. I love to work here. The location not fully strategic, somehow i try my best to perform.",5,Junior Executive (Sales & Marketing),Muadzam Shah Pahang,former,5,5,5,5,4,high comission,low basic,4,60,https://malaysia.indeed.com/cmp/Bank-Rakyat/reviews?start=60
29 September 2016,very tough work place,have to prepare schedule every day regarding money have to use that day....prepare marketing tool and product for my clerk and marketing dept and operation dept...,2,Executive,Muar,former,2,3,2,2,3,medical free,always have to prepare to be tranfer to other place,4,60,https://malaysia.indeed.com/cmp/Bank-Rakyat/reviews?start=60
19 September 2016,Good,"Good place to work, good benefits to staff, environment was also good, and the most enjoy part of the job is the management give appreciation that satisfied the staff.",4,Clerk,Kuching,former,4,3,4,4,4,,,4,60,https://malaysia.indeed.com/cmp/Bank-Rakyat/reviews?start=60
6 September 2016,Productive and likes family members,Staff at that company such a good members and like family members. My supervisor are good sv and he always give opportunities to me to join their career fair at KLCC. I so excited with that event and that event give me a lot new knowledge.,5,Internship,Kuala Lumpur,former,5,5,5,5,5,Have a nice pantry a lot of food because hari raya potluck,,4,60,https://malaysia.indeed.com/cmp/Bank-Rakyat/reviews?start=60
6 September 2016,Fun work place,"Hardest to find customer, have a good working mate and profesional branch manager. Fun work place, always be patience when face any problem, especially from your boss",4,BR Smart,Likas,current,4,4,3,5,4,Good branch manager,Bad,4,60,https://malaysia.indeed.com/cmp/Bank-Rakyat/reviews?start=60
4 September 2016,have a good provided,'- have a library - have a large pentry - area in work station is comfortable - work in team is good. - relationship staff with team leader good,3,tele-collector officer,Kuala Lumpur,current,3,3,3,3,3,,,4,60,https://malaysia.indeed.com/cmp/Bank-Rakyat/reviews?start=60
3 August 2016,Great co-workers,"The location and building itself is one of the best parts of the job, food options are also of many variety for lunch and co-workers and head were very friendly and welcoming.",4,Intern,Kuala Lumpur,former,3,3,4,3,4,,,4,60,https://malaysia.indeed.com/cmp/Bank-Rakyat/reviews?start=60
14 July 2016,more experience,i can learn how to communicate with customer and how to handle personal loan at bank rakyat. I also can about system bank using.,5,br-smart,Sarawak,current,0,0,0,0,0,,short break,4,60,https://malaysia.indeed.com/cmp/Bank-Rakyat/reviews?start=60
30 May 2016,Equipped with adequate comfort with basic equipment for carrying out tasks,'- Near a surau and washroom. - Tutoring by senior colleagues while on duty. - Colleagues friendly. - A colleague who always give a commitment to work to get the maximum output and efficiency.,5,Marketing Manager,Port Dickson,former,5,5,5,5,5,,,4,60,https://malaysia.indeed.com/cmp/Bank-Rakyat/reviews?start=60
15 April 2016,"productive, fun workplace","i started my work from 8.30a.m until 5.30 p.m. i learned a lot from the management like handling customer, filling up their loan document, key in customer data, and doing marketing. i gained a lot of experience with the environment and other co-workers. they taught me how to calculate the loan and dealing with the customers. the hardest part in this job areas was the skill needed when faces with shrewish customer. but the most enjoyable part of the job is when u have good relation with other worker and the company management. at the end you will have a lot of experience either it is good or bad environment.",4,practical,Kuala Kangsar,current,4,4,4,4,4,,,4,60,https://malaysia.indeed.com/cmp/Bank-Rakyat/reviews?start=60
7 March 2016,workplace fun,must be full time. learn about accounting and audit. management was good to make workplace for fun. must be enjoy to make a work.,5,BR SMART,Sabah,former,3,4,5,5,3,free lunches,healthcare,4,60,https://malaysia.indeed.com/cmp/Bank-Rakyat/reviews?start=60
5 February 2016,Fun and Helpful,It always fun having friendly colleagues. I learned something new everyday and this place has a great working environment.,5,Clerk,"Brickfields, Kuala Lumpur",current,5,3,4,4,4,,,4,60,https://malaysia.indeed.com/cmp/Bank-Rakyat/reviews?start=60
27 December 2015,Productive.,"Friendly co-workers and I have learned how to communicate with the community. Beside that, I have improved my ability to work in a group and learned how to become a flexible person in adapting any situation.",4,Sales & Marketing,"Sabah, Malaysia",former,0,0,0,0,0,,,4,60,https://malaysia.indeed.com/cmp/Bank-Rakyat/reviews?start=60
26 October 2015,Productive and cheerful,"One of the dominant islamic bank and rapidly growing in Malaysia. With a new HQ and new working environment, they are heading towards a positive growth for many more years to come.",3,Senior Executive,"Kuala Lumpur, M14",current,3,3,3,3,3,adequate,no comment,4,60,https://malaysia.indeed.com/cmp/Bank-Rakyat/reviews?start=60
9 October 2015,productive and enjoyable,"From my point of view, this company is quite good. They have give an opportunity to work with them even I'm a fresh graduate and have a minimum in work experience. They have teach me how to choose the prospect of marketing that can be used during I perform my work.The staff also are very friendly. They always helps me in conducting my job. They also help me when I have a some confuse during perform the job.",5,BR SMART,M08,current,5,5,5,5,4,morning briefing,small commission,4,60,https://malaysia.indeed.com/cmp/Bank-Rakyat/reviews?start=60
8 September 2015,Productive and enjoyable work environment,Best place to work with fun and supportive management. This place give the opportunity to excel and show your talent and works. Workers are helping each other for the company growth. The best part was working among my colleagues and they are very friendly and not reluctant to share the information and willingly to teach those who are needed.,5,Practical Student,"Kuantan, M06",former,4,5,4,4,4,Flexible time break,Quite small place with many customers especially during peak hour,4,60,https://malaysia.indeed.com/cmp/Bank-Rakyat/reviews?start=60
3 September 2015,productive worker must know how to manage his/her stress. He / She can manage time accurately. Always smile and happy.,"All those that company had ,can make me happy. I will improved my experienced through this company. I'm so glad if i get one position in this company. i'm not expected too high, because i'm a new learning. the most enjoyable part of job was working with senior . I love to work in team .",5,Assistant Accountant,Johor Bahru,current,5,5,5,5,5,healthcare,short breaks,5,80,https://malaysia.indeed.com/cmp/Bank-Rakyat/reviews?start=80
3 September 2015,responsible and effective jobs,"what i learn in company bank rakyat is learn to good team work,responsible with jobs and must strong in get customer to achieve the many customer for every months.The management is very good and every employees can share their experiences in achieve customers.Its is the most enjoyable part of the job because the jobs is very easy but i must strong to get customer because many competitors with many company and people.",4,pegawai pemasaran,"Kemaman, M11",former,4,5,4,5,4,,,5,80,https://malaysia.indeed.com/cmp/Bank-Rakyat/reviews?start=80
30 January 2015,Enjoyable working environment,"Rotation on different department such as financing unit, documentation unit, operation unit. I learn much on how to deal with customers, learn to communicate each others.",5,Practical trainee,"Segamat, M01",former,5,5,5,5,5,,,5,80,https://malaysia.indeed.com/cmp/Bank-Rakyat/reviews?start=80
2 December 2013,Fun working environment,"I did the administrative works and assist staff in multiple task to ensure that I can get the clear picture about banking industry. I've learn a lot of things such as the way or techniques to promote the products, how to interact with the customers, how to market the products to the potential customers and also how to work in a group. The management is very good in handling their staff and customers and the co workers there always offer assistance when i need their consultation. Over all this company is very fun and enjoyable workplace surrounded with family-like environment between their staff.",4,Practical Student,"Kuantan, M06",former,4,4,4,4,4,provide with all the job's benefit,'-,5,80,https://malaysia.indeed.com/cmp/Bank-Rakyat/reviews?start=80
